[2025-07-03T01:57:59.000Z] From: 6281291119767 (rayhan)
Message: Saya mau complaint

✅ Auto-reply successfully sent to 6281291119767
[2025-07-03T01:58:48.000Z] From: 6281291119767 (rayhan)
Message: Provinsi: 1
No. Spbkb: JKT01
Keluhan: agak mual

❌ Failed to send to M-Files: undefined
[2025-07-03T02:08:07.000Z] From: 6281291119767 (rayhan)
Message: Halo

✅ Auto-reply successfully sent to 6281291119767
[2025-07-03T02:08:19.000Z] From: 6281291119767 (rayhan)
Message: Provinsi: 1
No. Spbkb: JKT01
Keluhan: agak mual

❌ Failed to send to M-Files: undefined
[2025-07-03T02:20:06.000Z] From: 6281291119767 (rayhan)
Message: Hai

✅ Auto-reply successfully sent to 6281291119767
[2025-07-03T02:20:17.000Z] From: 6281291119767 (rayhan)
Message: Provinsi: 1
No. Spbkb: JKT01
Keluhan: agak mual

❌ Failed to send to M-Files: undefined
[2025-07-03T02:34:36.000Z] From: 6281291119767 (rayhan)
Message: Hai

✅ Auto-reply successfully sent to 6281291119767
[2025-07-03T02:34:48.000Z] From: 6281291119767 (rayhan)
Message: Provinsi: 1
No. Spbkb: JKT01
Keluhan: agak mual

❌ Failed to send to M-Files: "❌ Error during request: getaddrinfo ENOTFOUND http://jktdc-mfileapp.akr.co.id"
[2025-07-03T02:46:14.000Z] From: 6281291119767 (rayhan)
Message: Hi

✅ Auto-reply successfully sent to 6281291119767
[2025-07-03T02:46:25.000Z] From: 6281291119767 (rayhan)
Message: Provinsi: 1
No. Spbkb: JKT01
Keluhan: agak mual

❌ Failed to send to M-Files: "❌ Error during request: getaddrinfo ENOTFOUND https://jktdc-mfileapp.akr.co.id"
[2025-07-03T02:57:56.000Z] From: 6281291119767 (rayhan)
Message: Hi

✅ Auto-reply successfully sent to 6281291119767
[2025-07-03T02:58:05.000Z] From: 6281291119767 (rayhan)
Message: Provinsi: 1
No. Spbkb: JKT01
Keluhan: agak mual

❌ Failed to send to M-Files: "❌ Error during request: getaddrinfo ENOTFOUND jktdc-mfileapp.akr.co.id"
[2025-07-03T03:07:07.000Z] From: 6281291119767 (rayhan)
Message: Hi

✅ Auto-reply successfully sent to 6281291119767
[2025-07-03T03:07:18.000Z] From: 6281291119767 (rayhan)
Message: Provinsi: 1
No. Spbkb: JKT01
Keluhan: agak mual

❌ Failed to send to M-Files: request to http://jktdc-mfileapp.akr.co.id/REST/objects/238 failed, reason: getaddrinfo ENOTFOUND jktdc-mfileapp.akr.co.id
[2025-07-03T03:12:19.000Z] From: 6281291119767 (rayhan)
Message: Hi

✅ Auto-reply successfully sent to 6281291119767
[2025-07-03T03:12:31.000Z] From: 6281291119767 (rayhan)
Message: Provinsi: 1
No. Spbkb: JKT01
Keluhan: agak mual

{
  "Title": "CSF/JUL/25/11",
  "EscapedTitleWithID": "CSF{2}JUL{2}25{2}11 (ID 238-1505)",
  "DisplayID": "1505",
  "ObjVer": {
    "Version": 1,
    "VersionType": 4,
    "ID": 1505,
    "Type": 238
  },
  "Class": 152,
  "CheckedOutAtUtc": "1601-01-01T00:00:00Z",
  "CheckedOutAt": "1601-01-01T00:00:00Z",
  "LastModifiedUtc": "2025-07-03T03:12:39Z",
  "LastModified": "2025-07-03T03:12:39Z",
  "ObjectCheckedOut": false,
  "ObjectCheckedOutToThisUser": false,
  "CheckedOutTo": 0,
  "SingleFile": false,
  "HasRelationshipsFrom": false,
  "HasRelationshipsTo": false,
  "HasRelationshipsFromThis": false,
  "HasRelationshipsToThis": false,
  "HasAssignments": false,
  "Deleted": false,
  "IsStub": false,
  "ThisVersionLatestToThisUser": true,
  "CreatedUtc": "2025-07-03T03:12:39Z",
  "Created": "2025-07-03T03:12:39Z",
  "Files": [],
  "VisibleAfterOperation": true,
  "PathInIDView": "238\\1-1000\\1505\\S\\v1",
  "LastModifiedDisplayValue": "7/3/2025 3:12 AM",
  "CheckedOutAtDisplayValue": "1/1/1601 12:00 AM",
  "CreatedDisplayValue": "7/3/2025 3:12 AM",
  "ObjectVersionFlags": 2,
  "Score": 0,
  "LastAccessedByMe": "2025-07-03T03:12:39Z",
  "AccessedByMeUtc": "2025-07-03T03:12:39Z",
  "AccessedByMe": "2025-07-03T03:12:39Z",
  "ObjectGUID": "{EC67CDC6-4584-439D-9572-EE5ED46AFA80}",
  "ObjectCapabilityFlags": -1,
  "ObjectFlags": 68,
  "propertyID": 0,
  "LatestCheckedInVersion": 1,
  "BaseProperties": []
}
[2025-07-03T03:17:39.000Z] From: 6281944829289 (LW😁)
Message: Halo

✅ Auto-reply successfully sent to 6281944829289
[2025-07-03T03:18:40.000Z] From: 6281944829289 (LW😁)
Message: 2
Abc
Apa ya

✅ Auto-reply successfully sent to 6281944829289
[2025-07-03T03:19:29.000Z] From: 6281944829289 (LW😁)
Message: Silahkan input provinsi dan keluhan anda sesuai dengan format dibawah ini:
Provinsi : 3
No. SPBKB: 123
Keluhan : testing

{
  "Title": "CSF/JUL/25/12",
  "EscapedTitleWithID": "CSF{2}JUL{2}25{2}12 (ID 238-1506)",
  "DisplayID": "1506",
  "ObjVer": {
    "Version": 1,
    "VersionType": 4,
    "ID": 1506,
    "Type": 238
  },
  "Class": 152,
  "CheckedOutAtUtc": "1601-01-01T00:00:00Z",
  "CheckedOutAt": "1601-01-01T00:00:00Z",
  "LastModifiedUtc": "2025-07-03T03:19:39Z",
  "LastModified": "2025-07-03T03:19:39Z",
  "ObjectCheckedOut": false,
  "ObjectCheckedOutToThisUser": false,
  "CheckedOutTo": 0,
  "SingleFile": false,
  "HasRelationshipsFrom": false,
  "HasRelationshipsTo": false,
  "HasRelationshipsFromThis": false,
  "HasRelationshipsToThis": false,
  "HasAssignments": false,
  "Deleted": false,
  "IsStub": false,
  "ThisVersionLatestToThisUser": true,
  "CreatedUtc": "2025-07-03T03:19:39Z",
  "Created": "2025-07-03T03:19:39Z",
  "Files": [],
  "VisibleAfterOperation": true,
  "PathInIDView": "238\\1-1000\\1506\\S\\v1",
  "LastModifiedDisplayValue": "7/3/2025 3:19 AM",
  "CheckedOutAtDisplayValue": "1/1/1601 12:00 AM",
  "CreatedDisplayValue": "7/3/2025 3:19 AM",
  "ObjectVersionFlags": 2,
  "Score": 0,
  "LastAccessedByMe": "2025-07-03T03:19:40Z",
  "AccessedByMeUtc": "2025-07-03T03:19:40Z",
  "AccessedByMe": "2025-07-03T03:19:40Z",
  "ObjectGUID": "{7C98E862-7777-4443-9F2B-E0048603BA6C}",
  "ObjectCapabilityFlags": -1,
  "ObjectFlags": 68,
  "propertyID": 0,
  "LatestCheckedInVersion": 1,
  "BaseProperties": []
}
[2025-07-03T03:29:25.000Z] From: 6281290633338 (Erin)
Message: Test Complain

✅ Auto-reply successfully sent to 6281290633338
[2025-07-03T03:29:49.000Z] From: 6281290633338 (Erin)
Message: Semarang

✅ Auto-reply successfully sent to 6281290633338
[2025-07-03T03:29:59.000Z] From: 6281290633338 (Erin)
Message: 3. Semarang

✅ Auto-reply successfully sent to 6281290633338
[2025-07-03T03:30:31.000Z] From: 6281290633338 (Erin)
Message: Silahkan input provinsi dan keluhan anda sesuai dengan format dibawah ini:
Provinsi : 
1. Jakarta
2.
No. SPBKB: (Input No. SPBKB)
Keluhan : Lama bgt

{
  "Title": "CSF/JUL/25/13",
  "EscapedTitleWithID": "CSF{2}JUL{2}25{2}13 (ID 238-1507)",
  "DisplayID": "1507",
  "ObjVer": {
    "Version": 1,
    "VersionType": 4,
    "ID": 1507,
    "Type": 238
  },
  "Class": 152,
  "CheckedOutAtUtc": "1601-01-01T00:00:00Z",
  "CheckedOutAt": "1601-01-01T00:00:00Z",
  "LastModifiedUtc": "2025-07-03T03:30:42Z",
  "LastModified": "2025-07-03T03:30:42Z",
  "ObjectCheckedOut": false,
  "ObjectCheckedOutToThisUser": false,
  "CheckedOutTo": 0,
  "SingleFile": false,
  "HasRelationshipsFrom": false,
  "HasRelationshipsTo": false,
  "HasRelationshipsFromThis": false,
  "HasRelationshipsToThis": false,
  "HasAssignments": false,
  "Deleted": false,
  "IsStub": false,
  "ThisVersionLatestToThisUser": true,
  "CreatedUtc": "2025-07-03T03:30:42Z",
  "Created": "2025-07-03T03:30:42Z",
  "Files": [],
  "VisibleAfterOperation": true,
  "PathInIDView": "238\\1-1000\\1507\\S\\v1",
  "LastModifiedDisplayValue": "7/3/2025 3:30 AM",
  "CheckedOutAtDisplayValue": "1/1/1601 12:00 AM",
  "CreatedDisplayValue": "7/3/2025 3:30 AM",
  "ObjectVersionFlags": 2,
  "Score": 0,
  "LastAccessedByMe": "2025-07-03T03:30:43Z",
  "AccessedByMeUtc": "2025-07-03T03:30:43Z",
  "AccessedByMe": "2025-07-03T03:30:43Z",
  "ObjectGUID": "{45E9DA28-B71D-4CDF-94B1-6CFF45759553}",
  "ObjectCapabilityFlags": -1,
  "ObjectFlags": 68,
  "propertyID": 0,
  "LatestCheckedInVersion": 1,
  "BaseProperties": []
}
[2025-07-03T04:42:20.000Z] From: 6281944829289 (LW😁)
Message: Komplen part 2

✅ Auto-reply successfully sent to 6281944829289
[2025-07-03T04:43:44.000Z] From: 6281944829289 (LW😁)
Message: Silahkan input provinsi dan keluhan anda sesuai dengan format dibawah ini:
Provinsi : 3
No. SPBKB: 
Keluhan : tes sepanjang apa formatnyahshshdh hrhrhbehwhsb hajajajiqowiehrhhr jwhehehhrjfbfhduwuau ushwhwhehdhhfhfjdjeuwiiwiajhshdhe dudjhshwitigifufydugohlgifufufifigjgkhlhlhjgjfhfhfi ititsitoagogogsogsogidgdogodgeoheiheoheojoehoehoegldoheohoshoheohowhoshskvidhodhodhldhohdohidgkegihwojpxhichihdigsohoshosgosgoegigeigeigidgiehieyiyeige8ge9yeoyoey9ehoehodhohdodhpdhodhohdohdohodhoehoehohd kdhodhogdogdigeogiegidgohdohdohodhodhoru9dhohdohdohdohf0

{
  "Title": "CSF/JUL/25/14",
  "EscapedTitleWithID": "CSF{2}JUL{2}25{2}14 (ID 238-1508)",
  "DisplayID": "1508",
  "ObjVer": {
    "Version": 1,
    "VersionType": 4,
    "ID": 1508,
    "Type": 238
  },
  "Class": 152,
  "CheckedOutAtUtc": "1601-01-01T00:00:00Z",
  "CheckedOutAt": "1601-01-01T00:00:00Z",
  "LastModifiedUtc": "2025-07-03T04:43:54Z",
  "LastModified": "2025-07-03T04:43:54Z",
  "ObjectCheckedOut": false,
  "ObjectCheckedOutToThisUser": false,
  "CheckedOutTo": 0,
  "SingleFile": false,
  "HasRelationshipsFrom": false,
  "HasRelationshipsTo": false,
  "HasRelationshipsFromThis": false,
  "HasRelationshipsToThis": false,
  "HasAssignments": false,
  "Deleted": false,
  "IsStub": false,
  "ThisVersionLatestToThisUser": true,
  "CreatedUtc": "2025-07-03T04:43:54Z",
  "Created": "2025-07-03T04:43:54Z",
  "Files": [],
  "VisibleAfterOperation": true,
  "PathInIDView": "238\\1-1000\\1508\\S\\v1",
  "LastModifiedDisplayValue": "7/3/2025 4:43 AM",
  "CheckedOutAtDisplayValue": "1/1/1601 12:00 AM",
  "CreatedDisplayValue": "7/3/2025 4:43 AM",
  "ObjectVersionFlags": 2,
  "Score": 0,
  "LastAccessedByMe": "2025-07-03T04:43:55Z",
  "AccessedByMeUtc": "2025-07-03T04:43:55Z",
  "AccessedByMe": "2025-07-03T04:43:55Z",
  "ObjectGUID": "{F7F47119-A95E-448B-95DD-8994F4EEBD3E}",
  "ObjectCapabilityFlags": -1,
  "ObjectFlags": 68,
  "propertyID": 0,
  "LatestCheckedInVersion": 1,
  "BaseProperties": []
}
[2025-07-07T03:12:16.000Z] From: 6281291119767 (rayhan)
Message: Hi

✅ Auto-reply successfully sent to 6281291119767
[2025-07-07T03:15:17.000Z] From: 6281291119767 (rayhan)
Message: Hi

✅ Auto-reply successfully sent to 6281291119767
[2025-07-07T07:06:54.000Z] From: 6281291119767 (rayhan)
Message: Hi

✅ Auto-reply successfully sent to 6281291119767
[2025-07-07T07:07:26.000Z] From: 6281291119767 (rayhan)
Message: Silahkan input Provinsi dan detail keluhan anda sesuai dengan format dibawah ini :

Provinsi : (input no Provinsi)
1. Sumatera Utara

{
  "Status": 400,
  "URL": "/objects/238",
  "Method": "POST",
  "Exception": {
    "Name": "ArgumentException",
    "Message": "Malformed data."
  },
  "Stack": "Error reference ID: 3de493bc-8a8d-4966-a96e-32675d148108",
  "Message": "Malformed data.",
  "IsLoggedToVault": true,
  "IsLoggedToApplication": true,
  "ExceptionName": "ArgumentException"
}
❌ The response from M-Files is invalid or incomplete. 
[2025-07-08T02:12:03.000Z] From: 6281291119767 (rayhan)
Message: Hi

✅ Auto-reply successfully sent to 6281291119767
[2025-07-08T02:16:38.000Z] From: 6281291119767 (rayhan)
Message: Hi

✅ Auto-reply successfully sent to 6281291119767
[2025-07-08T02:17:51.000Z] From: 6281291119767 (rayhan)
Message: Silahkan input Provinsi dan detail keluhan anda sesuai dengan format dibawah ini :

Provinsi : 7

Keluhan : testing-rayhan

{
  "Title": "CSF/JUL/25/16",
  "EscapedTitleWithID": "CSF{2}JUL{2}25{2}16 (ID 238-1510)",
  "DisplayID": "1510",
  "ObjVer": {
    "Version": 1,
    "VersionType": 4,
    "ID": 1510,
    "Type": 238
  },
  "Class": 325,
  "CheckedOutAtUtc": "1601-01-01T00:00:00Z",
  "CheckedOutAt": "1601-01-01T00:00:00Z",
  "LastModifiedUtc": "2025-07-08T02:17:58Z",
  "LastModified": "2025-07-08T02:17:58Z",
  "ObjectCheckedOut": false,
  "ObjectCheckedOutToThisUser": false,
  "CheckedOutTo": 0,
  "SingleFile": false,
  "HasRelationshipsFrom": false,
  "HasRelationshipsTo": false,
  "HasRelationshipsFromThis": false,
  "HasRelationshipsToThis": false,
  "HasAssignments": false,
  "Deleted": false,
  "IsStub": false,
  "ThisVersionLatestToThisUser": true,
  "CreatedUtc": "2025-07-08T02:17:58Z",
  "Created": "2025-07-08T02:17:58Z",
  "Files": [],
  "VisibleAfterOperation": true,
  "PathInIDView": "238\\1-1000\\1510\\S\\v1",
  "LastModifiedDisplayValue": "7/8/2025 2:17 AM",
  "CheckedOutAtDisplayValue": "1/1/1601 12:00 AM",
  "CreatedDisplayValue": "7/8/2025 2:17 AM",
  "ObjectVersionFlags": 0,
  "Score": 0,
  "LastAccessedByMe": "2025-07-08T02:17:59Z",
  "AccessedByMeUtc": "2025-07-08T02:17:59Z",
  "AccessedByMe": "2025-07-08T02:17:59Z",
  "ObjectGUID": "{D2658934-A060-460C-A4B9-EF07297D2C09}",
  "ObjectCapabilityFlags": -1,
  "ObjectFlags": 68,
  "propertyID": 0,
  "LatestCheckedInVersion": 1,
  "BaseProperties": []
}
[2025-07-09T03:28:27.000Z] From: 6281291119767 (rayhan)
Message: Hi

✅ Auto-reply successfully sent to 6281291119767
[2025-07-09T03:30:43.000Z] From: 6281291119767 (rayhan)
Message: https://wa.me/+628111278118?text=Provinsi%20%3A%207%0A%0AKeluhan%20%3A%20testing-rayhan

{
  "Status": 400,
  "URL": "/objects/238",
  "Method": "POST",
  "Exception": {
    "Name": "ArgumentException",
    "Message": "Malformed data."
  },
  "Stack": "Error reference ID: 2c8d85ae-5b66-4279-97f6-48c747af4922",
  "Message": "Malformed data.",
  "IsLoggedToVault": true,
  "IsLoggedToApplication": true,
  "ExceptionName": "ArgumentException"
}
❌ The response from M-Files is invalid or incomplete. 
[2025-07-09T03:33:49.000Z] From: 6281291119767 (rayhan)
Message: Silahkan input Provinsi dan detail keluhan anda sesuai dengan format dibawah ini :

Provinsi : 7

Keluhan : testing-rayhan

{
  "ErrorCode": "2020",
  "Status": 500,
  "URL": "/objects/238",
  "Method": "POST",
  "Exception": {
    "Name": "COMException",
    "Message": "Access denied.\r\nYou are not allowed to attach objects to the \"325\" class.",
    "InnerException": {
      "Name": "MFilesException",
      "Message": "Access denied.\r\nYou are not allowed to attach objects to the \"325\" class.",
      "StackText": "Error reference ID: 33a616fc-11d6-4c90-b2f0-30eb498d747c",
      "ErrorCode": "2020"
    }
  },
  "Stack": "Error reference ID: 33a616fc-11d6-4c90-b2f0-30eb498d747c",
  "Message": "Access denied.\r\nYou are not allowed to attach objects to the \"325\" class.",
  "IsLoggedToVault": true,
  "IsLoggedToApplication": true,
  "ExceptionName": "COMException"
}
❌ The response from M-Files is invalid or incomplete. 
[2025-07-09T03:34:12.000Z] From: 6281291119767 (rayhan)
Message: Silahkan input Provinsi dan detail keluhan anda sesuai dengan format dibawah ini :

Provinsi : 7

Keluhan : testing-rayhan

{
  "ErrorCode": "1157",
  "Status": 500,
  "URL": "/objects/238",
  "Method": "POST",
  "Exception": {
    "Name": "COMException",
    "Message": "The operation you requested was unsuccessful due to a concurrent operation performed by another user or process. Try performing the operation again.\n\nIf the problem persists, contact your M-Files system administrator.",
    "InnerException": {
      "Name": "MFilesException",
      "Message": "The operation you requested was unsuccessful due to a concurrent operation performed by another user or process. Try performing the operation again.\n\nIf the problem persists, contact your M-Files system administrator.",
      "StackText": "Error reference ID: d32e5e88-2bdb-49eb-acd5-389c57ce64ff",
      "ErrorCode": "1157"
    }
  },
  "Stack": "Error reference ID: d32e5e88-2bdb-49eb-acd5-389c57ce64ff",
  "Message": "The operation you requested was unsuccessful due to a concurrent operation performed by another user or process. Try performing the operation again.\n\nIf the problem persists, contact your M-Files system administrator.",
  "IsLoggedToVault": true,
  "IsLoggedToApplication": true,
  "ExceptionName": "COMException"
}
❌ The response from M-Files is invalid or incomplete. 
[2025-07-09T04:07:57.000Z] From: 6281291119767 (rayhan)
Message: Hi

✅ Auto-reply successfully sent to 6281291119767
[2025-07-09T04:08:06.000Z] From: 6281291119767 (rayhan)
Message: Silahkan input Provinsi dan detail keluhan anda sesuai dengan format dibawah ini :

Provinsi : 7

Keluhan : testing-rayhan

{
  "Title": "CSF/JUL/25/18",
  "EscapedTitleWithID": "CSF{2}JUL{2}25{2}18 (ID 238-1514)",
  "DisplayID": "1514",
  "ObjVer": {
    "Version": 1,
    "VersionType": 4,
    "ID": 1514,
    "Type": 238
  },
  "Class": 325,
  "CheckedOutAtUtc": "1601-01-01T00:00:00Z",
  "CheckedOutAt": "1601-01-01T00:00:00Z",
  "LastModifiedUtc": "2025-07-09T04:08:14Z",
  "LastModified": "2025-07-09T04:08:14Z",
  "ObjectCheckedOut": false,
  "ObjectCheckedOutToThisUser": false,
  "CheckedOutTo": 0,
  "SingleFile": false,
  "HasRelationshipsFrom": false,
  "HasRelationshipsTo": false,
  "HasRelationshipsFromThis": false,
  "HasRelationshipsToThis": false,
  "HasAssignments": false,
  "Deleted": false,
  "IsStub": false,
  "ThisVersionLatestToThisUser": true,
  "CreatedUtc": "2025-07-09T04:08:14Z",
  "Created": "2025-07-09T04:08:14Z",
  "Files": [],
  "VisibleAfterOperation": true,
  "PathInIDView": "238\\1-1000\\1514\\S\\v1",
  "LastModifiedDisplayValue": "7/9/2025 4:08 AM",
  "CheckedOutAtDisplayValue": "1/1/1601 12:00 AM",
  "CreatedDisplayValue": "7/9/2025 4:08 AM",
  "ObjectVersionFlags": 2,
  "Score": 0,
  "LastAccessedByMe": "2025-07-09T04:08:15Z",
  "AccessedByMeUtc": "2025-07-09T04:08:15Z",
  "AccessedByMe": "2025-07-09T04:08:15Z",
  "ObjectGUID": "{5394FFD8-95DE-4636-B64B-C70969BE46E4}",
  "ObjectCapabilityFlags": -1,
  "ObjectFlags": 68,
  "propertyID": 0,
  "LatestCheckedInVersion": 1,
  "BaseProperties": []
}
[2025-07-09T04:10:26.000Z] From: 6285752304328 (Adprianto Christiawan)
Message: Silahkan input Provinsi dan detail keluhan anda sesuai dengan format dibawah ini :

Provinsi : 7

Keluhan : testing-rayhan

{
  "Title": "CSF/JUL/25/19",
  "EscapedTitleWithID": "CSF{2}JUL{2}25{2}19 (ID 238-1515)",
  "DisplayID": "1515",
  "ObjVer": {
    "Version": 1,
    "VersionType": 4,
    "ID": 1515,
    "Type": 238
  },
  "Class": 325,
  "CheckedOutAtUtc": "1601-01-01T00:00:00Z",
  "CheckedOutAt": "1601-01-01T00:00:00Z",
  "LastModifiedUtc": "2025-07-09T04:10:38Z",
  "LastModified": "2025-07-09T04:10:38Z",
  "ObjectCheckedOut": false,
  "ObjectCheckedOutToThisUser": false,
  "CheckedOutTo": 0,
  "SingleFile": false,
  "HasRelationshipsFrom": false,
  "HasRelationshipsTo": false,
  "HasRelationshipsFromThis": false,
  "HasRelationshipsToThis": false,
  "HasAssignments": false,
  "Deleted": false,
  "IsStub": false,
  "ThisVersionLatestToThisUser": true,
  "CreatedUtc": "2025-07-09T04:10:38Z",
  "Created": "2025-07-09T04:10:38Z",
  "Files": [],
  "VisibleAfterOperation": true,
  "PathInIDView": "238\\1-1000\\1515\\S\\v1",
  "LastModifiedDisplayValue": "7/9/2025 4:10 AM",
  "CheckedOutAtDisplayValue": "1/1/1601 12:00 AM",
  "CreatedDisplayValue": "7/9/2025 4:10 AM",
  "ObjectVersionFlags": 2,
  "Score": 0,
  "LastAccessedByMe": "2025-07-09T04:10:39Z",
  "AccessedByMeUtc": "2025-07-09T04:10:39Z",
  "AccessedByMe": "2025-07-09T04:10:39Z",
  "ObjectGUID": "{764331F2-41BA-4342-9C9F-CF0CE691F427}",
  "ObjectCapabilityFlags": -1,
  "ObjectFlags": 68,
  "propertyID": 0,
  "LatestCheckedInVersion": 1,
  "BaseProperties": []
}
[2025-07-09T04:10:49.000Z] From: 6285752304328 (Adprianto Christiawan)
Message: Hi

✅ Auto-reply successfully sent to 6285752304328
[2025-07-09T04:11:24.000Z] From: 6285752304328 (Adprianto Christiawan)
Message: 1

✅ Auto-reply successfully sent to 6285752304328
[2025-07-09T04:11:32.000Z] From: 6285752304328 (Adprianto Christiawan)
Message: 6

✅ Auto-reply successfully sent to 6285752304328
[2025-07-09T06:23:56.000Z] From: 6285752304328 (Adprianto Christiawan)
Message: Hi

✅ Auto-reply successfully sent to 6285752304328
[2025-07-10T06:56:46.000Z] From: 6281291119767 (rayhan)
Message: Hi

✅ Auto-reply successfully sent to 6281291119767
[2025-07-10T06:57:14.000Z] From: 6281291119767 (rayhan)
Message: Silahkan input Provinsi dan detail keluhan anda sesuai dengan format dibawah ini :

Provinsi : 7

Keluhan : 
spbkb 1234577880

Ada rusak apar

{
  "Title": "CSF/JUL/25/20",
  "EscapedTitleWithID": "CSF{2}JUL{2}25{2}20 (ID 238-1516)",
  "DisplayID": "1516",
  "ObjVer": {
    "Version": 1,
    "VersionType": 4,
    "ID": 1516,
    "Type": 238
  },
  "Class": 325,
  "CheckedOutAtUtc": "1601-01-01T00:00:00Z",
  "CheckedOutAt": "1601-01-01T00:00:00Z",
  "LastModifiedUtc": "2025-07-10T06:57:21Z",
  "LastModified": "2025-07-10T06:57:21Z",
  "ObjectCheckedOut": false,
  "ObjectCheckedOutToThisUser": false,
  "CheckedOutTo": 0,
  "SingleFile": false,
  "HasRelationshipsFrom": false,
  "HasRelationshipsTo": false,
  "HasRelationshipsFromThis": false,
  "HasRelationshipsToThis": false,
  "HasAssignments": false,
  "Deleted": false,
  "IsStub": false,
  "ThisVersionLatestToThisUser": true,
  "CreatedUtc": "2025-07-10T06:57:21Z",
  "Created": "2025-07-10T06:57:21Z",
  "Files": [],
  "VisibleAfterOperation": true,
  "PathInIDView": "238\\1-1000\\1516\\S\\v1",
  "LastModifiedDisplayValue": "7/10/2025 6:57 AM",
  "CheckedOutAtDisplayValue": "1/1/1601 12:00 AM",
  "CreatedDisplayValue": "7/10/2025 6:57 AM",
  "ObjectVersionFlags": 2,
  "Score": 0,
  "LastAccessedByMe": "2025-07-10T06:57:22Z",
  "AccessedByMeUtc": "2025-07-10T06:57:22Z",
  "AccessedByMe": "2025-07-10T06:57:22Z",
  "ObjectGUID": "{B2AB33E3-6798-45B0-BB7F-7F72C8E43C66}",
  "ObjectCapabilityFlags": -1,
  "ObjectFlags": 68,
  "propertyID": 0,
  "LatestCheckedInVersion": 1,
  "BaseProperties": []
}
[2025-07-11T09:41:20.000Z] From: 6281944829289 (LW😁)
Message: Hai, saya ingin menyampaikan keluhan
1. Provinsi : Jakarta
2. Keluhan: 10.2.1.001 - SPBKB Kapuk, keluhan saya....

terima kasih

{
  "Status": 400,
  "URL": "/objects/238",
  "Method": "POST",
  "Exception": {
    "Name": "ArgumentException",
    "Message": "Malformed data."
  },
  "Stack": "Error reference ID: e710c1e4-852e-489c-825e-ebd78bebf864",
  "Message": "Malformed data.",
  "IsLoggedToVault": true,
  "IsLoggedToApplication": true,
  "ExceptionName": "ArgumentException"
}
❌ The response from M-Files is invalid or incomplete. 
[2025-07-11T09:41:51.000Z] From: 6281944829289 (LW😁)
Message: Hai, saya ingin menyampaikan keluhan
1. Provinsi : Jakarta
2. Keluhan: 10.2.1.001 - SPBKB Kapuk, keluhan saya....

terima kasih

{
  "Status": 400,
  "URL": "/objects/238",
  "Method": "POST",
  "Exception": {
    "Name": "ArgumentException",
    "Message": "Malformed data."
  },
  "Stack": "Error reference ID: 5a3dabd0-f39b-4c8e-a6db-e02e57090ffc",
  "Message": "Malformed data.",
  "IsLoggedToVault": true,
  "IsLoggedToApplication": true,
  "ExceptionName": "ArgumentException"
}
❌ The response from M-Files is invalid or incomplete. 
[2025-07-11T09:42:25.000Z] From: 6281944829289 (LW😁)
Message: Hai, saya ingin menyampaikan keluhan
3.Provinsi : Jakarta
Keluhan: 10.2.1.001 - SPBKB Kapuk, keluhan saya....

terima kasih

{
  "Status": 400,
  "URL": "/objects/238",
  "Method": "POST",
  "Exception": {
    "Name": "ArgumentException",
    "Message": "Malformed data."
  },
  "Stack": "Error reference ID: 1bce4fdc-3e73-4331-b413-834bfaf67814",
  "Message": "Malformed data.",
  "IsLoggedToVault": true,
  "IsLoggedToApplication": true,
  "ExceptionName": "ArgumentException"
}
❌ The response from M-Files is invalid or incomplete. 
[2025-07-11T09:42:58.000Z] From: 6281944829289 (LW😁)
Message: Hai, saya ingin menyampaikan keluhan
Provinsi :  3.DKI Jakarta
Keluhan: 10.2.1.001 - SPBKB Kapuk, keluhan saya....

terima kasih

{
  "Title": "CSF/JUL/25/21",
  "EscapedTitleWithID": "CSF{2}JUL{2}25{2}21 (ID 238-1517)",
  "DisplayID": "1517",
  "ObjVer": {
    "Version": 1,
    "VersionType": 4,
    "ID": 1517,
    "Type": 238
  },
  "Class": 325,
  "CheckedOutAtUtc": "1601-01-01T00:00:00Z",
  "CheckedOutAt": "1601-01-01T00:00:00Z",
  "LastModifiedUtc": "2025-07-11T09:42:59Z",
  "LastModified": "2025-07-11T09:42:59Z",
  "ObjectCheckedOut": false,
  "ObjectCheckedOutToThisUser": false,
  "CheckedOutTo": 0,
  "SingleFile": false,
  "HasRelationshipsFrom": false,
  "HasRelationshipsTo": false,
  "HasRelationshipsFromThis": false,
  "HasRelationshipsToThis": false,
  "HasAssignments": false,
  "Deleted": false,
  "IsStub": false,
  "ThisVersionLatestToThisUser": true,
  "CreatedUtc": "2025-07-11T09:42:59Z",
  "Created": "2025-07-11T09:42:59Z",
  "Files": [],
  "VisibleAfterOperation": true,
  "PathInIDView": "238\\1-1000\\1517\\S\\v1",
  "LastModifiedDisplayValue": "7/11/2025 9:42 AM",
  "CheckedOutAtDisplayValue": "1/1/1601 12:00 AM",
  "CreatedDisplayValue": "7/11/2025 9:42 AM",
  "ObjectVersionFlags": 2,
  "Score": 0,
  "LastAccessedByMe": "2025-07-11T09:43:00Z",
  "AccessedByMeUtc": "2025-07-11T09:43:00Z",
  "AccessedByMe": "2025-07-11T09:43:00Z",
  "ObjectGUID": "{1305C784-6909-44A0-8513-BCB28B965266}",
  "ObjectCapabilityFlags": -1,
  "ObjectFlags": 68,
  "propertyID": 0,
  "LatestCheckedInVersion": 1,
  "BaseProperties": []
}
[2025-07-14T00:51:58.000Z] From: 6281291119767 (rayhan)
Message: Hi

✅ Auto-reply successfully sent to 6281291119767
[2025-07-14T00:52:16.000Z] From: 6281291119767 (rayhan)
Message: Silahkan input Provinsi dan detail keluhan anda sesuai dengan format dibawah ini :

Provinsi : 7

Keluhan : testing-rayhan

{
  "Title": "CSF/JUL/25/22",
  "EscapedTitleWithID": "CSF{2}JUL{2}25{2}22 (ID 238-1518)",
  "DisplayID": "1518",
  "ObjVer": {
    "Version": 1,
    "VersionType": 4,
    "ID": 1518,
    "Type": 238
  },
  "Class": 325,
  "CheckedOutAtUtc": "1601-01-01T00:00:00Z",
  "CheckedOutAt": "1601-01-01T00:00:00Z",
  "LastModifiedUtc": "2025-07-14T00:52:23Z",
  "LastModified": "2025-07-14T00:52:23Z",
  "ObjectCheckedOut": false,
  "ObjectCheckedOutToThisUser": false,
  "CheckedOutTo": 0,
  "SingleFile": false,
  "HasRelationshipsFrom": false,
  "HasRelationshipsTo": false,
  "HasRelationshipsFromThis": false,
  "HasRelationshipsToThis": false,
  "HasAssignments": false,
  "Deleted": false,
  "IsStub": false,
  "ThisVersionLatestToThisUser": true,
  "CreatedUtc": "2025-07-14T00:52:23Z",
  "Created": "2025-07-14T00:52:23Z",
  "Files": [],
  "VisibleAfterOperation": true,
  "PathInIDView": "238\\1-1000\\1518\\S\\v1",
  "LastModifiedDisplayValue": "7/14/2025 12:52 AM",
  "CheckedOutAtDisplayValue": "1/1/1601 12:00 AM",
  "CreatedDisplayValue": "7/14/2025 12:52 AM",
  "ObjectVersionFlags": 2,
  "Score": 0,
  "LastAccessedByMe": "2025-07-14T00:52:25Z",
  "AccessedByMeUtc": "2025-07-14T00:52:25Z",
  "AccessedByMe": "2025-07-14T00:52:25Z",
  "ObjectGUID": "{AFC8982C-2394-4BBD-8339-E7A63A8BAE60}",
  "ObjectCapabilityFlags": -1,
  "ObjectFlags": 68,
  "propertyID": 0,
  "LatestCheckedInVersion": 1,
  "BaseProperties": []
}
[2025-07-14T01:06:57.000Z] From: 6281291119767 (rayhan)
Message: Silahkan input Provinsi dan detail keluhan anda sesuai dengan format dibawah ini :

Provinsi : 11

Keluhan : testing-rayhan

{
  "EscapedTitleWithID": " (ID 0)",
  "DisplayID": "0",
  "ObjVer": {
    "Version": 0,
    "VersionType": 0,
    "ID": 0,
    "Type": 0
  },
  "Class": 0,
  "CheckedOutAtUtc": "1601-01-01T00:00:00Z",
  "CheckedOutAt": "1601-01-01T00:00:00Z",
  "LastModifiedUtc": "1601-01-01T00:00:00Z",
  "LastModified": "1601-01-01T00:00:00Z",
  "ObjectCheckedOut": false,
  "ObjectCheckedOutToThisUser": false,
  "CheckedOutTo": 0,
  "SingleFile": false,
  "HasRelationshipsFrom": false,
  "HasRelationshipsTo": false,
  "HasRelationshipsFromThis": false,
  "HasRelationshipsToThis": false,
  "HasAssignments": false,
  "Deleted": false,
  "IsStub": false,
  "ThisVersionLatestToThisUser": true,
  "CreatedUtc": "1601-01-01T00:00:00Z",
  "Created": "1601-01-01T00:00:00Z",
  "Files": [],
  "VisibleAfterOperation": false,
  "PathInIDView": "0\\0-999\\S\\v0",
  "LastModifiedDisplayValue": "1/1/1601 12:00 AM",
  "CheckedOutAtDisplayValue": "1/1/1601 12:00 AM",
  "CreatedDisplayValue": "1/1/1601 12:00 AM",
  "ObjectVersionFlags": 0,
  "Score": 0,
  "LastAccessedByMe": "1899-12-30T00:00:00Z",
  "AccessedByMeUtc": "1899-12-30T00:00:00Z",
  "AccessedByMe": "1899-12-30T00:00:00Z",
  "ObjectGUID": "{00000000-0000-0000-0000-000000000000}",
  "ObjectCapabilityFlags": 0,
  "ObjectFlags": 64,
  "propertyID": 0,
  "LatestCheckedInVersion": 0,
  "BaseProperties": []
}
❌ The response from M-Files is invalid or incomplete. 
[2025-07-14T01:07:14.000Z] From: 6281291119767 (rayhan)
Message: Silahkan input Provinsi dan detail keluhan anda sesuai dengan format dibawah ini :

Provinsi : 11

Keluhan : testing-rayhan

{
  "EscapedTitleWithID": " (ID 0)",
  "DisplayID": "0",
  "ObjVer": {
    "Version": 0,
    "VersionType": 0,
    "ID": 0,
    "Type": 0
  },
  "Class": 0,
  "CheckedOutAtUtc": "1601-01-01T00:00:00Z",
  "CheckedOutAt": "1601-01-01T00:00:00Z",
  "LastModifiedUtc": "1601-01-01T00:00:00Z",
  "LastModified": "1601-01-01T00:00:00Z",
  "ObjectCheckedOut": false,
  "ObjectCheckedOutToThisUser": false,
  "CheckedOutTo": 0,
  "SingleFile": false,
  "HasRelationshipsFrom": false,
  "HasRelationshipsTo": false,
  "HasRelationshipsFromThis": false,
  "HasRelationshipsToThis": false,
  "HasAssignments": false,
  "Deleted": false,
  "IsStub": false,
  "ThisVersionLatestToThisUser": true,
  "CreatedUtc": "1601-01-01T00:00:00Z",
  "Created": "1601-01-01T00:00:00Z",
  "Files": [],
  "VisibleAfterOperation": false,
  "PathInIDView": "0\\0-999\\S\\v0",
  "LastModifiedDisplayValue": "1/1/1601 12:00 AM",
  "CheckedOutAtDisplayValue": "1/1/1601 12:00 AM",
  "CreatedDisplayValue": "1/1/1601 12:00 AM",
  "ObjectVersionFlags": 0,
  "Score": 0,
  "LastAccessedByMe": "1899-12-30T00:00:00Z",
  "AccessedByMeUtc": "1899-12-30T00:00:00Z",
  "AccessedByMe": "1899-12-30T00:00:00Z",
  "ObjectGUID": "{00000000-0000-0000-0000-000000000000}",
  "ObjectCapabilityFlags": 0,
  "ObjectFlags": 64,
  "propertyID": 0,
  "LatestCheckedInVersion": 0,
  "BaseProperties": []
}
❌ The response from M-Files is invalid or incomplete. 
[2025-07-14T01:12:55.000Z] From: 6281291119767 (rayhan)
Message: Silahkan input Provinsi dan detail keluhan anda sesuai dengan format dibawah ini :

Provinsi : 11

Keluhan : testing-rayhan

{
  "EscapedTitleWithID": " (ID 0)",
  "DisplayID": "0",
  "ObjVer": {
    "Version": 0,
    "VersionType": 0,
    "ID": 0,
    "Type": 0
  },
  "Class": 0,
  "CheckedOutAtUtc": "1601-01-01T00:00:00Z",
  "CheckedOutAt": "1601-01-01T00:00:00Z",
  "LastModifiedUtc": "1601-01-01T00:00:00Z",
  "LastModified": "1601-01-01T00:00:00Z",
  "ObjectCheckedOut": false,
  "ObjectCheckedOutToThisUser": false,
  "CheckedOutTo": 0,
  "SingleFile": false,
  "HasRelationshipsFrom": false,
  "HasRelationshipsTo": false,
  "HasRelationshipsFromThis": false,
  "HasRelationshipsToThis": false,
  "HasAssignments": false,
  "Deleted": false,
  "IsStub": false,
  "ThisVersionLatestToThisUser": true,
  "CreatedUtc": "1601-01-01T00:00:00Z",
  "Created": "1601-01-01T00:00:00Z",
  "Files": [],
  "VisibleAfterOperation": false,
  "PathInIDView": "0\\0-999\\S\\v0",
  "LastModifiedDisplayValue": "1/1/1601 12:00 AM",
  "CheckedOutAtDisplayValue": "1/1/1601 12:00 AM",
  "CreatedDisplayValue": "1/1/1601 12:00 AM",
  "ObjectVersionFlags": 0,
  "Score": 0,
  "LastAccessedByMe": "1899-12-30T00:00:00Z",
  "AccessedByMeUtc": "1899-12-30T00:00:00Z",
  "AccessedByMe": "1899-12-30T00:00:00Z",
  "ObjectGUID": "{00000000-0000-0000-0000-000000000000}",
  "ObjectCapabilityFlags": 0,
  "ObjectFlags": 64,
  "propertyID": 0,
  "LatestCheckedInVersion": 0,
  "BaseProperties": []
}
❌ The response from M-Files is invalid or incomplete. 
[2025-07-14T01:14:13.000Z] From: 6281291119767 (rayhan)
Message: Silahkan input Provinsi dan detail keluhan anda sesuai dengan format dibawah ini :

Provinsi : 3

Keluhan : testing-rayhan

{
  "EscapedTitleWithID": " (ID 0)",
  "DisplayID": "0",
  "ObjVer": {
    "Version": 0,
    "VersionType": 0,
    "ID": 0,
    "Type": 0
  },
  "Class": 0,
  "CheckedOutAtUtc": "1601-01-01T00:00:00Z",
  "CheckedOutAt": "1601-01-01T00:00:00Z",
  "LastModifiedUtc": "1601-01-01T00:00:00Z",
  "LastModified": "1601-01-01T00:00:00Z",
  "ObjectCheckedOut": false,
  "ObjectCheckedOutToThisUser": false,
  "CheckedOutTo": 0,
  "SingleFile": false,
  "HasRelationshipsFrom": false,
  "HasRelationshipsTo": false,
  "HasRelationshipsFromThis": false,
  "HasRelationshipsToThis": false,
  "HasAssignments": false,
  "Deleted": false,
  "IsStub": false,
  "ThisVersionLatestToThisUser": true,
  "CreatedUtc": "1601-01-01T00:00:00Z",
  "Created": "1601-01-01T00:00:00Z",
  "Files": [],
  "VisibleAfterOperation": false,
  "PathInIDView": "0\\0-999\\S\\v0",
  "LastModifiedDisplayValue": "1/1/1601 12:00 AM",
  "CheckedOutAtDisplayValue": "1/1/1601 12:00 AM",
  "CreatedDisplayValue": "1/1/1601 12:00 AM",
  "ObjectVersionFlags": 0,
  "Score": 0,
  "LastAccessedByMe": "1899-12-30T00:00:00Z",
  "AccessedByMeUtc": "1899-12-30T00:00:00Z",
  "AccessedByMe": "1899-12-30T00:00:00Z",
  "ObjectGUID": "{00000000-0000-0000-0000-000000000000}",
  "ObjectCapabilityFlags": 0,
  "ObjectFlags": 64,
  "propertyID": 0,
  "LatestCheckedInVersion": 0,
  "BaseProperties": []
}
❌ The response from M-Files is invalid or incomplete. 
[2025-07-14T01:18:16.000Z] From: 6281291119767 (rayhan)
Message: Silahkan input Provinsi dan detail keluhan anda sesuai dengan format dibawah ini :

Provinsi : 11

Keluhan : testing-rayhan

{
  "Title": "CSF/JUL/25/28",
  "EscapedTitleWithID": "CSF{2}JUL{2}25{2}28 (ID 238-1524)",
  "DisplayID": "1524",
  "ObjVer": {
    "Version": 1,
    "VersionType": 4,
    "ID": 1524,
    "Type": 238
  },
  "Class": 325,
  "CheckedOutAtUtc": "1601-01-01T00:00:00Z",
  "CheckedOutAt": "1601-01-01T00:00:00Z",
  "LastModifiedUtc": "2025-07-14T01:18:23Z",
  "LastModified": "2025-07-14T01:18:23Z",
  "ObjectCheckedOut": false,
  "ObjectCheckedOutToThisUser": false,
  "CheckedOutTo": 0,
  "SingleFile": false,
  "HasRelationshipsFrom": false,
  "HasRelationshipsTo": false,
  "HasRelationshipsFromThis": false,
  "HasRelationshipsToThis": false,
  "HasAssignments": false,
  "Deleted": false,
  "IsStub": false,
  "ThisVersionLatestToThisUser": true,
  "CreatedUtc": "2025-07-14T01:18:23Z",
  "Created": "2025-07-14T01:18:23Z",
  "Files": [],
  "VisibleAfterOperation": true,
  "PathInIDView": "238\\1-1000\\1524\\S\\v1",
  "LastModifiedDisplayValue": "7/14/2025 1:18 AM",
  "CheckedOutAtDisplayValue": "1/1/1601 12:00 AM",
  "CreatedDisplayValue": "7/14/2025 1:18 AM",
  "ObjectVersionFlags": 2,
  "Score": 0,
  "LastAccessedByMe": "2025-07-14T01:18:24Z",
  "AccessedByMeUtc": "2025-07-14T01:18:24Z",
  "AccessedByMe": "2025-07-14T01:18:24Z",
  "ObjectGUID": "{6C374446-5D96-4D45-8E69-8630B708D9D9}",
  "ObjectCapabilityFlags": -1,
  "ObjectFlags": 68,
  "propertyID": 0,
  "LatestCheckedInVersion": 1,
  "BaseProperties": []
}
[2025-07-14T03:31:07.000Z] From: 6281291119767 (rayhan)
Message: Hi

✅ Auto-reply successfully sent to 6281291119767
[2025-07-14T03:31:21.000Z] From: 6281291119767 (rayhan)
Message: Silahkan input Provinsi dan detail keluhan anda sesuai dengan format dibawah ini :

Provinsi : 11

Keluhan : testing-rayhan

{
  "Title": "CSF/JUL/25/29",
  "EscapedTitleWithID": "CSF{2}JUL{2}25{2}29 (ID 238-1525)",
  "DisplayID": "1525",
  "ObjVer": {
    "Version": 1,
    "VersionType": 4,
    "ID": 1525,
    "Type": 238
  },
  "Class": 325,
  "CheckedOutAtUtc": "1601-01-01T00:00:00Z",
  "CheckedOutAt": "1601-01-01T00:00:00Z",
  "LastModifiedUtc": "2025-07-14T03:31:31Z",
  "LastModified": "2025-07-14T03:31:31Z",
  "ObjectCheckedOut": false,
  "ObjectCheckedOutToThisUser": false,
  "CheckedOutTo": 0,
  "SingleFile": false,
  "HasRelationshipsFrom": false,
  "HasRelationshipsTo": false,
  "HasRelationshipsFromThis": false,
  "HasRelationshipsToThis": false,
  "HasAssignments": false,
  "Deleted": false,
  "IsStub": false,
  "ThisVersionLatestToThisUser": true,
  "CreatedUtc": "2025-07-14T03:31:31Z",
  "Created": "2025-07-14T03:31:31Z",
  "Files": [],
  "VisibleAfterOperation": true,
  "PathInIDView": "238\\1-1000\\1525\\S\\v1",
  "LastModifiedDisplayValue": "7/14/2025 3:31 AM",
  "CheckedOutAtDisplayValue": "1/1/1601 12:00 AM",
  "CreatedDisplayValue": "7/14/2025 3:31 AM",
  "ObjectVersionFlags": 2,
  "Score": 0,
  "LastAccessedByMe": "2025-07-14T03:31:32Z",
  "AccessedByMeUtc": "2025-07-14T03:31:32Z",
  "AccessedByMe": "2025-07-14T03:31:32Z",
  "ObjectGUID": "{EF6E7E22-839B-4AAB-ADC8-797A656923F3}",
  "ObjectCapabilityFlags": -1,
  "ObjectFlags": 68,
  "propertyID": 0,
  "LatestCheckedInVersion": 1,
  "BaseProperties": []
}
[2025-07-14T08:28:34.000Z] From: 6281944829289 (LW😁)
Message: Silahkan input Provinsi dan detail keluhan anda sesuai dengan format dibawah ini :

Provinsi : 11

Keluhan : SPBKB Pulau Rakyat (Asahan)  saya mau komplen soal spkb ini kacau sekali

{
  "Title": "CSF/JUL/25/30",
  "EscapedTitleWithID": "CSF{2}JUL{2}25{2}30 (ID 238-1526)",
  "DisplayID": "1526",
  "ObjVer": {
    "Version": 1,
    "VersionType": 4,
    "ID": 1526,
    "Type": 238
  },
  "Class": 325,
  "CheckedOutAtUtc": "1601-01-01T00:00:00Z",
  "CheckedOutAt": "1601-01-01T00:00:00Z",
  "LastModifiedUtc": "2025-07-14T08:28:43Z",
  "LastModified": "2025-07-14T08:28:43Z",
  "ObjectCheckedOut": false,
  "ObjectCheckedOutToThisUser": false,
  "CheckedOutTo": 0,
  "SingleFile": false,
  "HasRelationshipsFrom": false,
  "HasRelationshipsTo": false,
  "HasRelationshipsFromThis": false,
  "HasRelationshipsToThis": false,
  "HasAssignments": false,
  "Deleted": false,
  "IsStub": false,
  "ThisVersionLatestToThisUser": true,
  "CreatedUtc": "2025-07-14T08:28:43Z",
  "Created": "2025-07-14T08:28:43Z",
  "Files": [],
  "VisibleAfterOperation": true,
  "PathInIDView": "238\\1-1000\\1526\\S\\v1",
  "LastModifiedDisplayValue": "7/14/2025 8:28 AM",
  "CheckedOutAtDisplayValue": "1/1/1601 12:00 AM",
  "CreatedDisplayValue": "7/14/2025 8:28 AM",
  "ObjectVersionFlags": 2,
  "Score": 0,
  "LastAccessedByMe": "2025-07-14T08:28:44Z",
  "AccessedByMeUtc": "2025-07-14T08:28:44Z",
  "AccessedByMe": "2025-07-14T08:28:44Z",
  "ObjectGUID": "{FED9A414-4DBD-43AA-8D9B-33B708D8E80A}",
  "ObjectCapabilityFlags": -1,
  "ObjectFlags": 68,
  "propertyID": 0,
  "LatestCheckedInVersion": 1,
  "BaseProperties": []
}
[2025-07-15T08:53:07.000Z] From: 6283807800752 (.)
Message: Tes

✅ Auto-reply successfully sent to 6283807800752
[2025-07-15T08:53:32.000Z] From: 6283807800752 (.)
Message: 3

✅ Auto-reply successfully sent to 6283807800752
[2025-07-15T08:54:42.000Z] From: 6283807800752 (.)
Message: 3
Bikin macey

✅ Auto-reply successfully sent to 6283807800752
[2025-07-15T08:54:59.000Z] From: 6281290633338 (Erin)
Message: Hi

✅ Auto-reply successfully sent to 6281290633338
[2025-07-15T08:55:30.000Z] From: 6283807800752 (.)
Message: Provinsi : 3
Keluhan : macet

{
  "Title": "CSF/JUL/25/31",
  "EscapedTitleWithID": "CSF{2}JUL{2}25{2}31 (ID 238-1527)",
  "DisplayID": "1527",
  "ObjVer": {
    "Version": 1,
    "VersionType": 4,
    "ID": 1527,
    "Type": 238
  },
  "Class": 325,
  "CheckedOutAtUtc": "1601-01-01T00:00:00Z",
  "CheckedOutAt": "1601-01-01T00:00:00Z",
  "LastModifiedUtc": "2025-07-15T08:55:37Z",
  "LastModified": "2025-07-15T08:55:37Z",
  "ObjectCheckedOut": false,
  "ObjectCheckedOutToThisUser": false,
  "CheckedOutTo": 0,
  "SingleFile": false,
  "HasRelationshipsFrom": false,
  "HasRelationshipsTo": false,
  "HasRelationshipsFromThis": false,
  "HasRelationshipsToThis": false,
  "HasAssignments": false,
  "Deleted": false,
  "IsStub": false,
  "ThisVersionLatestToThisUser": true,
  "CreatedUtc": "2025-07-15T08:55:37Z",
  "Created": "2025-07-15T08:55:37Z",
  "Files": [],
  "VisibleAfterOperation": true,
  "PathInIDView": "238\\1-1000\\1527\\S\\v1",
  "LastModifiedDisplayValue": "7/15/2025 8:55 AM",
  "CheckedOutAtDisplayValue": "1/1/1601 12:00 AM",
  "CreatedDisplayValue": "7/15/2025 8:55 AM",
  "ObjectVersionFlags": 2,
  "Score": 0,
  "LastAccessedByMe": "2025-07-15T08:55:37Z",
  "AccessedByMeUtc": "2025-07-15T08:55:37Z",
  "AccessedByMe": "2025-07-15T08:55:37Z",
  "ObjectGUID": "{6FB6ECD2-A28F-46EE-9147-A1D238EDC5AF}",
  "ObjectCapabilityFlags": -1,
  "ObjectFlags": 68,
  "propertyID": 0,
  "LatestCheckedInVersion": 1,
  "BaseProperties": []
}
[2025-07-15T08:56:08.000Z] From: 6283807800752 (.)
Message: Provinsi : 11
Keluhan : macet

{
  "Title": "CSF/JUL/25/32",
  "EscapedTitleWithID": "CSF{2}JUL{2}25{2}32 (ID 238-1528)",
  "DisplayID": "1528",
  "ObjVer": {
    "Version": 1,
    "VersionType": 4,
    "ID": 1528,
    "Type": 238
  },
  "Class": 325,
  "CheckedOutAtUtc": "1601-01-01T00:00:00Z",
  "CheckedOutAt": "1601-01-01T00:00:00Z",
  "LastModifiedUtc": "2025-07-15T08:56:15Z",
  "LastModified": "2025-07-15T08:56:15Z",
  "ObjectCheckedOut": false,
  "ObjectCheckedOutToThisUser": false,
  "CheckedOutTo": 0,
  "SingleFile": false,
  "HasRelationshipsFrom": false,
  "HasRelationshipsTo": false,
  "HasRelationshipsFromThis": false,
  "HasRelationshipsToThis": false,
  "HasAssignments": false,
  "Deleted": false,
  "IsStub": false,
  "ThisVersionLatestToThisUser": true,
  "CreatedUtc": "2025-07-15T08:56:15Z",
  "Created": "2025-07-15T08:56:15Z",
  "Files": [],
  "VisibleAfterOperation": true,
  "PathInIDView": "238\\1-1000\\1528\\S\\v1",
  "LastModifiedDisplayValue": "7/15/2025 8:56 AM",
  "CheckedOutAtDisplayValue": "1/1/1601 12:00 AM",
  "CreatedDisplayValue": "7/15/2025 8:56 AM",
  "ObjectVersionFlags": 2,
  "Score": 0,
  "LastAccessedByMe": "2025-07-15T08:56:15Z",
  "AccessedByMeUtc": "2025-07-15T08:56:15Z",
  "AccessedByMe": "2025-07-15T08:56:15Z",
  "ObjectGUID": "{ACEC79A6-252F-4C3E-852B-23379111051C}",
  "ObjectCapabilityFlags": -1,
  "ObjectFlags": 68,
  "propertyID": 0,
  "LatestCheckedInVersion": 1,
  "BaseProperties": []
}
[2025-07-15T08:56:26.000Z] From: 6281290633338 (Erin)
Message: 6

✅ Auto-reply successfully sent to 6281290633338
[2025-07-15T08:57:09.000Z] From: 6281290633338 (Erin)
Message: Provinis : 11

✅ Auto-reply successfully sent to 6281290633338
[2025-07-15T08:57:24.000Z] From: 6281290633338 (Erin)
Message: Provinsi 11
Keluhan lama

{
  "Status": 400,
  "URL": "/objects/238",
  "Method": "POST",
  "Exception": {
    "Name": "ArgumentException",
    "Message": "Malformed data."
  },
  "Stack": "Error reference ID: da476052-5be9-43f7-95cb-3e8146a6ab0a",
  "Message": "Malformed data.",
  "IsLoggedToVault": true,
  "IsLoggedToApplication": true,
  "ExceptionName": "ArgumentException"
}
❌ The response from M-Files is invalid or incomplete. 
[2025-07-15T08:57:57.000Z] From: 6283807800752 (.)
Message: Silahkan input Provinsi dan detail keluhan anda sesuai dengan format dibawah ini :

Provinsi : (Isi nomor Provinsi sesuai list dibawah)
Keluhan : (isi keluhan yang mau disampaikan)

List no Provinsi
1. Sumatera Utara
2. Lampung
3. DKI Jakarta
4. Jawa Barat
5. Jawa Tengah
6. DIY
7. Jawa Timur
8. Kalimantan Barat
9. Kalimantan Selatan
10. Kalimantan Timur

Keluhan : (cantumkan nomor SPBKB/SPBN serta detail keluhan anda)

{
  "Status": 400,
  "URL": "/objects/238",
  "Method": "POST",
  "Exception": {
    "Name": "ArgumentException",
    "Message": "Malformed data."
  },
  "Stack": "Error reference ID: ad176ace-90fd-44de-8ea0-1858b2d10857",
  "Message": "Malformed data.",
  "IsLoggedToVault": true,
  "IsLoggedToApplication": true,
  "ExceptionName": "ArgumentException"
}
❌ The response from M-Files is invalid or incomplete. 
[2025-07-15T08:57:55.000Z] From: 6281290633338 (Erin)
Message: Provinsi : 11
Keluhan : lama

{
  "Title": "CSF/JUL/25/33",
  "EscapedTitleWithID": "CSF{2}JUL{2}25{2}33 (ID 238-1529)",
  "DisplayID": "1529",
  "ObjVer": {
    "Version": 1,
    "VersionType": 4,
    "ID": 1529,
    "Type": 238
  },
  "Class": 325,
  "CheckedOutAtUtc": "1601-01-01T00:00:00Z",
  "CheckedOutAt": "1601-01-01T00:00:00Z",
  "LastModifiedUtc": "2025-07-15T08:58:05Z",
  "LastModified": "2025-07-15T08:58:05Z",
  "ObjectCheckedOut": false,
  "ObjectCheckedOutToThisUser": false,
  "CheckedOutTo": 0,
  "SingleFile": false,
  "HasRelationshipsFrom": false,
  "HasRelationshipsTo": false,
  "HasRelationshipsFromThis": false,
  "HasRelationshipsToThis": false,
  "HasAssignments": false,
  "Deleted": false,
  "IsStub": false,
  "ThisVersionLatestToThisUser": true,
  "CreatedUtc": "2025-07-15T08:58:05Z",
  "Created": "2025-07-15T08:58:05Z",
  "Files": [],
  "VisibleAfterOperation": true,
  "PathInIDView": "238\\1-1000\\1529\\S\\v1",
  "LastModifiedDisplayValue": "7/15/2025 8:58 AM",
  "CheckedOutAtDisplayValue": "1/1/1601 12:00 AM",
  "CreatedDisplayValue": "7/15/2025 8:58 AM",
  "ObjectVersionFlags": 2,
  "Score": 0,
  "LastAccessedByMe": "2025-07-15T08:58:06Z",
  "AccessedByMeUtc": "2025-07-15T08:58:06Z",
  "AccessedByMe": "2025-07-15T08:58:06Z",
  "ObjectGUID": "{C97E507C-C56E-41A8-977A-0ED9D3B1B7AE}",
  "ObjectCapabilityFlags": -1,
  "ObjectFlags": 68,
  "propertyID": 0,
  "LatestCheckedInVersion": 1,
  "BaseProperties": []
}
[2025-07-15T09:04:58.000Z] From: 6281290633338 (Erin)
Message: Silahkan input Provinsi dan detail keluhan anda sesuai dengan format dibawah ini :

Provinsi : 11

Keluhan : SPBKB Pulau Rakyat (Asahan)

{
  "Title": "CSF/JUL/25/34",
  "EscapedTitleWithID": "CSF{2}JUL{2}25{2}34 (ID 238-1530)",
  "DisplayID": "1530",
  "ObjVer": {
    "Version": 1,
    "VersionType": 4,
    "ID": 1530,
    "Type": 238
  },
  "Class": 325,
  "CheckedOutAtUtc": "1601-01-01T00:00:00Z",
  "CheckedOutAt": "1601-01-01T00:00:00Z",
  "LastModifiedUtc": "2025-07-15T09:05:05Z",
  "LastModified": "2025-07-15T09:05:05Z",
  "ObjectCheckedOut": false,
  "ObjectCheckedOutToThisUser": false,
  "CheckedOutTo": 0,
  "SingleFile": false,
  "HasRelationshipsFrom": false,
  "HasRelationshipsTo": false,
  "HasRelationshipsFromThis": false,
  "HasRelationshipsToThis": false,
  "HasAssignments": false,
  "Deleted": false,
  "IsStub": false,
  "ThisVersionLatestToThisUser": true,
  "CreatedUtc": "2025-07-15T09:05:05Z",
  "Created": "2025-07-15T09:05:05Z",
  "Files": [],
  "VisibleAfterOperation": true,
  "PathInIDView": "238\\1-1000\\1530\\S\\v1",
  "LastModifiedDisplayValue": "7/15/2025 9:05 AM",
  "CheckedOutAtDisplayValue": "1/1/1601 12:00 AM",
  "CreatedDisplayValue": "7/15/2025 9:05 AM",
  "ObjectVersionFlags": 2,
  "Score": 0,
  "LastAccessedByMe": "2025-07-15T09:05:06Z",
  "AccessedByMeUtc": "2025-07-15T09:05:06Z",
  "AccessedByMe": "2025-07-15T09:05:06Z",
  "ObjectGUID": "{061E4E94-7354-43D0-BD66-EBD0A2EC4AD1}",
  "ObjectCapabilityFlags": -1,
  "ObjectFlags": 68,
  "propertyID": 0,
  "LatestCheckedInVersion": 1,
  "BaseProperties": []
}
[2025-07-15T09:19:46.000Z] From: 628161982492 (Jws)
Message: Rese ya kalian

✅ Auto-reply successfully sent to 628161982492
[2025-07-15T09:20:58.000Z] From: 628161982492 (Jws)
Message: Provinsi:11
Keluhan: rese kalian

{
  "Title": "CSF/JUL/25/35",
  "EscapedTitleWithID": "CSF{2}JUL{2}25{2}35 (ID 238-1531)",
  "DisplayID": "1531",
  "ObjVer": {
    "Version": 1,
    "VersionType": 4,
    "ID": 1531,
    "Type": 238
  },
  "Class": 325,
  "CheckedOutAtUtc": "1601-01-01T00:00:00Z",
  "CheckedOutAt": "1601-01-01T00:00:00Z",
  "LastModifiedUtc": "2025-07-15T09:21:06Z",
  "LastModified": "2025-07-15T09:21:06Z",
  "ObjectCheckedOut": false,
  "ObjectCheckedOutToThisUser": false,
  "CheckedOutTo": 0,
  "SingleFile": false,
  "HasRelationshipsFrom": false,
  "HasRelationshipsTo": false,
  "HasRelationshipsFromThis": false,
  "HasRelationshipsToThis": false,
  "HasAssignments": false,
  "Deleted": false,
  "IsStub": false,
  "ThisVersionLatestToThisUser": true,
  "CreatedUtc": "2025-07-15T09:21:06Z",
  "Created": "2025-07-15T09:21:06Z",
  "Files": [],
  "VisibleAfterOperation": true,
  "PathInIDView": "238\\1-1000\\1531\\S\\v1",
  "LastModifiedDisplayValue": "7/15/2025 9:21 AM",
  "CheckedOutAtDisplayValue": "1/1/1601 12:00 AM",
  "CreatedDisplayValue": "7/15/2025 9:21 AM",
  "ObjectVersionFlags": 2,
  "Score": 0,
  "LastAccessedByMe": "2025-07-15T09:21:07Z",
  "AccessedByMeUtc": "2025-07-15T09:21:07Z",
  "AccessedByMe": "2025-07-15T09:21:07Z",
  "ObjectGUID": "{47C2BB98-9AAF-4DC1-8622-4B94208B523F}",
  "ObjectCapabilityFlags": -1,
  "ObjectFlags": 68,
  "propertyID": 0,
  "LatestCheckedInVersion": 1,
  "BaseProperties": []
}
[2025-07-15T09:24:07.000Z] From: 628161982492 (Jws)
Message: Provinsi: 3
SPBU Kapuk kurang bersih

✅ Auto-reply successfully sent to 628161982492
[2025-07-15T09:24:39.000Z] From: 628161982492 (Jws)
Message: Provinsi: 3
SPBU Kapuk kurang bersih

✅ Auto-reply successfully sent to 628161982492
[2025-07-15T09:26:26.000Z] From: 628161982492 (Jws)
Message: Provinsi: 3
Keluhan: SPBU Kapuk kurang bersih

{
  "Title": "CSF/JUL/25/36",
  "EscapedTitleWithID": "CSF{2}JUL{2}25{2}36 (ID 238-1532)",
  "DisplayID": "1532",
  "ObjVer": {
    "Version": 1,
    "VersionType": 4,
    "ID": 1532,
    "Type": 238
  },
  "Class": 325,
  "CheckedOutAtUtc": "1601-01-01T00:00:00Z",
  "CheckedOutAt": "1601-01-01T00:00:00Z",
  "LastModifiedUtc": "2025-07-15T09:26:36Z",
  "LastModified": "2025-07-15T09:26:36Z",
  "ObjectCheckedOut": false,
  "ObjectCheckedOutToThisUser": false,
  "CheckedOutTo": 0,
  "SingleFile": false,
  "HasRelationshipsFrom": false,
  "HasRelationshipsTo": false,
  "HasRelationshipsFromThis": false,
  "HasRelationshipsToThis": false,
  "HasAssignments": false,
  "Deleted": false,
  "IsStub": false,
  "ThisVersionLatestToThisUser": true,
  "CreatedUtc": "2025-07-15T09:26:36Z",
  "Created": "2025-07-15T09:26:36Z",
  "Files": [],
  "VisibleAfterOperation": true,
  "PathInIDView": "238\\1-1000\\1532\\S\\v1",
  "LastModifiedDisplayValue": "7/15/2025 9:26 AM",
  "CheckedOutAtDisplayValue": "1/1/1601 12:00 AM",
  "CreatedDisplayValue": "7/15/2025 9:26 AM",
  "ObjectVersionFlags": 2,
  "Score": 0,
  "LastAccessedByMe": "2025-07-15T09:26:37Z",
  "AccessedByMeUtc": "2025-07-15T09:26:37Z",
  "AccessedByMe": "2025-07-15T09:26:37Z",
  "ObjectGUID": "{D35CC89B-FBC3-47E3-9B65-991C5D6A65D8}",
  "ObjectCapabilityFlags": -1,
  "ObjectFlags": 68,
  "propertyID": 0,
  "LatestCheckedInVersion": 1,
  "BaseProperties": []
}
[2025-07-16T01:10:26.000Z] From: 6281291119767 (rayhan)
Message: Hu

✅ Auto-reply successfully sent to 6281291119767
[2025-07-16T01:14:26.000Z] From: 6281291119767 (rayhan)
Message: Hi

✅ Auto-reply successfully sent to 6281291119767
[2025-07-16T01:19:59.000Z] From: 6281291119767 (rayhan)
Message: Hi

✅ Auto-reply successfully sent to 6281291119767
[2025-07-16T01:20:50.000Z] From: 6281291119767 (rayhan)
Message: Silahkan input Provinsi dan detail keluhan anda *sesuai dengan format dibawah ini termasuk judul menu* :

Provinsi : 11
Keluhan : testing

{
  "Title": "CSF/JUL/25/38",
  "EscapedTitleWithID": "CSF{2}JUL{2}25{2}38 (ID 238-1534)",
  "DisplayID": "1534",
  "ObjVer": {
    "Version": 1,
    "VersionType": 4,
    "ID": 1534,
    "Type": 238
  },
  "Class": 325,
  "CheckedOutAtUtc": "1601-01-01T00:00:00Z",
  "CheckedOutAt": "1601-01-01T00:00:00Z",
  "LastModifiedUtc": "2025-07-16T01:21:01Z",
  "LastModified": "2025-07-16T01:21:01Z",
  "ObjectCheckedOut": false,
  "ObjectCheckedOutToThisUser": false,
  "CheckedOutTo": 0,
  "SingleFile": false,
  "HasRelationshipsFrom": false,
  "HasRelationshipsTo": false,
  "HasRelationshipsFromThis": false,
  "HasRelationshipsToThis": false,
  "HasAssignments": false,
  "Deleted": false,
  "IsStub": false,
  "ThisVersionLatestToThisUser": true,
  "CreatedUtc": "2025-07-16T01:21:01Z",
  "Created": "2025-07-16T01:21:01Z",
  "Files": [],
  "VisibleAfterOperation": true,
  "PathInIDView": "238\\1-1000\\1534\\S\\v1",
  "LastModifiedDisplayValue": "7/16/2025 1:21 AM",
  "CheckedOutAtDisplayValue": "1/1/1601 12:00 AM",
  "CreatedDisplayValue": "7/16/2025 1:21 AM",
  "ObjectVersionFlags": 2,
  "Score": 0,
  "LastAccessedByMe": "2025-07-16T01:21:02Z",
  "AccessedByMeUtc": "2025-07-16T01:21:02Z",
  "AccessedByMe": "2025-07-16T01:21:02Z",
  "ObjectGUID": "{CB994F34-29AB-4918-8B36-5F33F8393827}",
  "ObjectCapabilityFlags": -1,
  "ObjectFlags": 68,
  "propertyID": 0,
  "LatestCheckedInVersion": 1,
  "BaseProperties": []
}
[2025-07-16T04:29:32.000Z] From: 6285607312916 (o)
Message: tes

✅ Auto-reply successfully sent to 6285607312916
[2025-07-16T04:30:24.000Z] From: 6285607312916 (o)
Message: Silahkan input Provinsi dan detail keluhan anda *sesuai dengan format dibawah ini termasuk judul menu* :

Provinsi : 1
Keluhan : Testing

List no Provinsi
1. Sumatera Utara
2. Lampung
3. DKI Jakarta
4. Jawa Barat
5. Jawa Tengah
6. DIY
7. Jawa Timur
8. Kalimantan Barat
9. Kalimantan Selatan
10. Kalimantan Timur

{
  "Title": "CSF/JUL/25/39",
  "EscapedTitleWithID": "CSF{2}JUL{2}25{2}39 (ID 238-1535)",
  "DisplayID": "1535",
  "ObjVer": {
    "Version": 1,
    "VersionType": 4,
    "ID": 1535,
    "Type": 238
  },
  "Class": 325,
  "CheckedOutAtUtc": "1601-01-01T00:00:00Z",
  "CheckedOutAt": "1601-01-01T00:00:00Z",
  "LastModifiedUtc": "2025-07-16T04:30:25Z",
  "LastModified": "2025-07-16T04:30:25Z",
  "ObjectCheckedOut": false,
  "ObjectCheckedOutToThisUser": false,
  "CheckedOutTo": 0,
  "SingleFile": false,
  "HasRelationshipsFrom": false,
  "HasRelationshipsTo": false,
  "HasRelationshipsFromThis": false,
  "HasRelationshipsToThis": false,
  "HasAssignments": false,
  "Deleted": false,
  "IsStub": false,
  "ThisVersionLatestToThisUser": true,
  "CreatedUtc": "2025-07-16T04:30:25Z",
  "Created": "2025-07-16T04:30:25Z",
  "Files": [],
  "VisibleAfterOperation": true,
  "PathInIDView": "238\\1-1000\\1535\\S\\v1",
  "LastModifiedDisplayValue": "7/16/2025 4:30 AM",
  "CheckedOutAtDisplayValue": "1/1/1601 12:00 AM",
  "CreatedDisplayValue": "7/16/2025 4:30 AM",
  "ObjectVersionFlags": 2,
  "Score": 0,
  "LastAccessedByMe": "2025-07-16T04:30:27Z",
  "AccessedByMeUtc": "2025-07-16T04:30:27Z",
  "AccessedByMe": "2025-07-16T04:30:27Z",
  "ObjectGUID": "{2AF33300-52C6-4280-A617-8081BC09B37D}",
  "ObjectCapabilityFlags": -1,
  "ObjectFlags": 68,
  "propertyID": 0,
  "LatestCheckedInVersion": 1,
  "BaseProperties": []
}
[2025-07-16T04:42:03.000Z] From: 6283807800752 (.)
Message: Tes

✅ Auto-reply successfully sent to 6283807800752
[2025-07-17T07:30:07.000Z] From: 6285640873353 (🅐🅙🅘 🅦🅘🅡🅐🅦🅐🅝)
Message: Test

✅ Auto-reply successfully sent to 6285640873353
[2025-07-22T08:59:47.000Z] From: 6287883624205 (Dianna)
Message: Silahkan input Provinsi dan detail keluhan anda sesuai dengan format dibawah ini :

Provinsi : 1

Keluhan : SPBN Tanjung Tiram [isi dengan keluhan anda]

{
  "Title": "CSF/JUL/25/40",
  "EscapedTitleWithID": "CSF{2}JUL{2}25{2}40 (ID 238-1536)",
  "DisplayID": "1536",
  "ObjVer": {
    "Version": 1,
    "VersionType": 4,
    "ID": 1536,
    "Type": 238
  },
  "Class": 325,
  "CheckedOutAtUtc": "1601-01-01T00:00:00Z",
  "CheckedOutAt": "1601-01-01T00:00:00Z",
  "LastModifiedUtc": "2025-07-22T08:59:56Z",
  "LastModified": "2025-07-22T08:59:56Z",
  "ObjectCheckedOut": false,
  "ObjectCheckedOutToThisUser": false,
  "CheckedOutTo": 0,
  "SingleFile": false,
  "HasRelationshipsFrom": false,
  "HasRelationshipsTo": false,
  "HasRelationshipsFromThis": false,
  "HasRelationshipsToThis": false,
  "HasAssignments": false,
  "Deleted": false,
  "IsStub": false,
  "ThisVersionLatestToThisUser": true,
  "CreatedUtc": "2025-07-22T08:59:56Z",
  "Created": "2025-07-22T08:59:56Z",
  "Files": [],
  "VisibleAfterOperation": true,
  "PathInIDView": "238\\1-1000\\1536\\S\\v1",
  "LastModifiedDisplayValue": "7/22/2025 8:59 AM",
  "CheckedOutAtDisplayValue": "1/1/1601 12:00 AM",
  "CreatedDisplayValue": "7/22/2025 8:59 AM",
  "ObjectVersionFlags": 2,
  "Score": 0,
  "LastAccessedByMe": "2025-07-22T08:59:57Z",
  "AccessedByMeUtc": "2025-07-22T08:59:57Z",
  "AccessedByMe": "2025-07-22T08:59:57Z",
  "ObjectGUID": "{6B68EBCF-078F-47EB-8BE3-8D20C4F7447C}",
  "ObjectCapabilityFlags": -1,
  "ObjectFlags": 68,
  "propertyID": 0,
  "LatestCheckedInVersion": 1,
  "BaseProperties": []
}
[2025-07-22T08:59:57.000Z] From: 6287883624205 (Dianna)
Message: 1

✅ Auto-reply successfully sent to 6287883624205
[2025-07-30T10:19:16.000Z] From: 6281234000050 (hehe)
Message: Silahkan input Provinsi dan detail keluhan anda sesuai dengan format dibawah ini :

Provinsi : 3

Keluhan : SPBKB Kapuk [isi dengan keluhan anda]

{
  "Title": "CSF/JUL/25/41",
  "EscapedTitleWithID": "CSF{2}JUL{2}25{2}41 (ID 238-1537)",
  "DisplayID": "1537",
  "ObjVer": {
    "Version": 1,
    "VersionType": 4,
    "ID": 1537,
    "Type": 238
  },
  "Class": 325,
  "CheckedOutAtUtc": "1601-01-01T00:00:00Z",
  "CheckedOutAt": "1601-01-01T00:00:00Z",
  "LastModifiedUtc": "2025-07-30T10:19:29Z",
  "LastModified": "2025-07-30T10:19:29Z",
  "ObjectCheckedOut": false,
  "ObjectCheckedOutToThisUser": false,
  "CheckedOutTo": 0,
  "SingleFile": false,
  "HasRelationshipsFrom": false,
  "HasRelationshipsTo": false,
  "HasRelationshipsFromThis": false,
  "HasRelationshipsToThis": false,
  "HasAssignments": false,
  "Deleted": false,
  "IsStub": false,
  "ThisVersionLatestToThisUser": true,
  "CreatedUtc": "2025-07-30T10:19:29Z",
  "Created": "2025-07-30T10:19:29Z",
  "Files": [],
  "VisibleAfterOperation": true,
  "PathInIDView": "238\\1-1000\\1537\\S\\v1",
  "LastModifiedDisplayValue": "7/30/2025 10:19 AM",
  "CheckedOutAtDisplayValue": "1/1/1601 12:00 AM",
  "CreatedDisplayValue": "7/30/2025 10:19 AM",
  "ObjectVersionFlags": 2,
  "Score": 0,
  "LastAccessedByMe": "2025-07-30T10:19:30Z",
  "AccessedByMeUtc": "2025-07-30T10:19:30Z",
  "AccessedByMe": "2025-07-30T10:19:30Z",
  "ObjectGUID": "{20D4E827-4B71-4CB7-9F0B-93C09187EA8B}",
  "ObjectCapabilityFlags": -1,
  "ObjectFlags": 68,
  "propertyID": 0,
  "LatestCheckedInVersion": 1,
  "BaseProperties": []
}
[2025-07-30T10:27:18.000Z] From: 6281234000050 (hehe)
Message: Silahkan input Provinsi dan detail keluhan anda sesuai dengan format dibawah ini :

Provinsi : 7

Keluhan : SPBKB Kapongan [isi dengan keluhan anda]

{
  "Title": "CSF/JUL/25/42",
  "EscapedTitleWithID": "CSF{2}JUL{2}25{2}42 (ID 238-1538)",
  "DisplayID": "1538",
  "ObjVer": {
    "Version": 1,
    "VersionType": 4,
    "ID": 1538,
    "Type": 238
  },
  "Class": 325,
  "CheckedOutAtUtc": "1601-01-01T00:00:00Z",
  "CheckedOutAt": "1601-01-01T00:00:00Z",
  "LastModifiedUtc": "2025-07-30T10:27:26Z",
  "LastModified": "2025-07-30T10:27:26Z",
  "ObjectCheckedOut": false,
  "ObjectCheckedOutToThisUser": false,
  "CheckedOutTo": 0,
  "SingleFile": false,
  "HasRelationshipsFrom": false,
  "HasRelationshipsTo": false,
  "HasRelationshipsFromThis": false,
  "HasRelationshipsToThis": false,
  "HasAssignments": false,
  "Deleted": false,
  "IsStub": false,
  "ThisVersionLatestToThisUser": true,
  "CreatedUtc": "2025-07-30T10:27:26Z",
  "Created": "2025-07-30T10:27:26Z",
  "Files": [],
  "VisibleAfterOperation": true,
  "PathInIDView": "238\\1-1000\\1538\\S\\v1",
  "LastModifiedDisplayValue": "7/30/2025 10:27 AM",
  "CheckedOutAtDisplayValue": "1/1/1601 12:00 AM",
  "CreatedDisplayValue": "7/30/2025 10:27 AM",
  "ObjectVersionFlags": 2,
  "Score": 0,
  "LastAccessedByMe": "2025-07-30T10:27:27Z",
  "AccessedByMeUtc": "2025-07-30T10:27:27Z",
  "AccessedByMe": "2025-07-30T10:27:27Z",
  "ObjectGUID": "{DA980F23-873B-47FD-B84D-BE2B8BAA0B5B}",
  "ObjectCapabilityFlags": -1,
  "ObjectFlags": 68,
  "propertyID": 0,
  "LatestCheckedInVersion": 1,
  "BaseProperties": []
}
[2025-07-31T04:39:13.000Z] From: 6281261770271 (Zahara)
Message: Silahkan input Provinsi dan detail keluhan anda sesuai dengan format dibawah ini :

Provinsi : 5

Keluhan : SPBN Jambean [isi dengan keluhan anda]

{
  "Title": "CSF/JUL/25/43",
  "EscapedTitleWithID": "CSF{2}JUL{2}25{2}43 (ID 238-1539)",
  "DisplayID": "1539",
  "ObjVer": {
    "Version": 1,
    "VersionType": 4,
    "ID": 1539,
    "Type": 238
  },
  "Class": 325,
  "CheckedOutAtUtc": "1601-01-01T00:00:00Z",
  "CheckedOutAt": "1601-01-01T00:00:00Z",
  "LastModifiedUtc": "2025-07-31T04:39:19Z",
  "LastModified": "2025-07-31T04:39:19Z",
  "ObjectCheckedOut": false,
  "ObjectCheckedOutToThisUser": false,
  "CheckedOutTo": 0,
  "SingleFile": false,
  "HasRelationshipsFrom": false,
  "HasRelationshipsTo": false,
  "HasRelationshipsFromThis": false,
  "HasRelationshipsToThis": false,
  "HasAssignments": false,
  "Deleted": false,
  "IsStub": false,
  "ThisVersionLatestToThisUser": true,
  "CreatedUtc": "2025-07-31T04:39:19Z",
  "Created": "2025-07-31T04:39:19Z",
  "Files": [],
  "VisibleAfterOperation": true,
  "PathInIDView": "238\\1-1000\\1539\\S\\v1",
  "LastModifiedDisplayValue": "7/31/2025 4:39 AM",
  "CheckedOutAtDisplayValue": "1/1/1601 12:00 AM",
  "CreatedDisplayValue": "7/31/2025 4:39 AM",
  "ObjectVersionFlags": 2,
  "Score": 0,
  "LastAccessedByMe": "2025-07-31T04:39:20Z",
  "AccessedByMeUtc": "2025-07-31T04:39:20Z",
  "AccessedByMe": "2025-07-31T04:39:20Z",
  "ObjectGUID": "{2A3D36D2-111D-4101-B9CE-694EF5959826}",
  "ObjectCapabilityFlags": -1,
  "ObjectFlags": 68,
  "propertyID": 0,
  "LatestCheckedInVersion": 1,
  "BaseProperties": []
}
[2025-07-31T06:18:16.000Z] From: 6283818308828 (aufan)
Message: Silahkan input Provinsi dan detail keluhan anda sesuai dengan format dibawah ini :

Provinsi : 8

Keluhan : SPBKB Budi Utomo [isi dengan keluhan anda]

{
  "Title": "CSF/JUL/25/44",
  "EscapedTitleWithID": "CSF{2}JUL{2}25{2}44 (ID 238-1540)",
  "DisplayID": "1540",
  "ObjVer": {
    "Version": 1,
    "VersionType": 4,
    "ID": 1540,
    "Type": 238
  },
  "Class": 325,
  "CheckedOutAtUtc": "1601-01-01T00:00:00Z",
  "CheckedOutAt": "1601-01-01T00:00:00Z",
  "LastModifiedUtc": "2025-07-31T06:18:20Z",
  "LastModified": "2025-07-31T06:18:20Z",
  "ObjectCheckedOut": false,
  "ObjectCheckedOutToThisUser": false,
  "CheckedOutTo": 0,
  "SingleFile": false,
  "HasRelationshipsFrom": false,
  "HasRelationshipsTo": false,
  "HasRelationshipsFromThis": false,
  "HasRelationshipsToThis": false,
  "HasAssignments": false,
  "Deleted": false,
  "IsStub": false,
  "ThisVersionLatestToThisUser": true,
  "CreatedUtc": "2025-07-31T06:18:20Z",
  "Created": "2025-07-31T06:18:20Z",
  "Files": [],
  "VisibleAfterOperation": true,
  "PathInIDView": "238\\1-1000\\1540\\S\\v1",
  "LastModifiedDisplayValue": "7/31/2025 6:18 AM",
  "CheckedOutAtDisplayValue": "1/1/1601 12:00 AM",
  "CreatedDisplayValue": "7/31/2025 6:18 AM",
  "ObjectVersionFlags": 2,
  "Score": 0,
  "LastAccessedByMe": "2025-07-31T06:18:21Z",
  "AccessedByMeUtc": "2025-07-31T06:18:21Z",
  "AccessedByMe": "2025-07-31T06:18:21Z",
  "ObjectGUID": "{5F9ADFF5-DDB9-4152-A99A-9E78F39D82D3}",
  "ObjectCapabilityFlags": -1,
  "ObjectFlags": 68,
  "propertyID": 0,
  "LatestCheckedInVersion": 1,
  "BaseProperties": []
}
[2025-07-31T06:19:25.000Z] From: 6283818308828 (aufan)
Message: Silahkan input Provinsi dan detail keluhan anda sesuai dengan format dibawah ini :

Provinsi : 9

Keluhan : SPBKB Cempaka [isi dengan keluhan anda]

{
  "Title": "CSF/JUL/25/45",
  "EscapedTitleWithID": "CSF{2}JUL{2}25{2}45 (ID 238-1541)",
  "DisplayID": "1541",
  "ObjVer": {
    "Version": 1,
    "VersionType": 4,
    "ID": 1541,
    "Type": 238
  },
  "Class": 325,
  "CheckedOutAtUtc": "1601-01-01T00:00:00Z",
  "CheckedOutAt": "1601-01-01T00:00:00Z",
  "LastModifiedUtc": "2025-07-31T06:20:06Z",
  "LastModified": "2025-07-31T06:20:06Z",
  "ObjectCheckedOut": false,
  "ObjectCheckedOutToThisUser": false,
  "CheckedOutTo": 0,
  "SingleFile": false,
  "HasRelationshipsFrom": false,
  "HasRelationshipsTo": false,
  "HasRelationshipsFromThis": false,
  "HasRelationshipsToThis": false,
  "HasAssignments": false,
  "Deleted": false,
  "IsStub": false,
  "ThisVersionLatestToThisUser": true,
  "CreatedUtc": "2025-07-31T06:20:06Z",
  "Created": "2025-07-31T06:20:06Z",
  "Files": [],
  "VisibleAfterOperation": true,
  "PathInIDView": "238\\1-1000\\1541\\S\\v1",
  "LastModifiedDisplayValue": "7/31/2025 6:20 AM",
  "CheckedOutAtDisplayValue": "1/1/1601 12:00 AM",
  "CreatedDisplayValue": "7/31/2025 6:20 AM",
  "ObjectVersionFlags": 2,
  "Score": 0,
  "LastAccessedByMe": "2025-07-31T06:20:07Z",
  "AccessedByMeUtc": "2025-07-31T06:20:07Z",
  "AccessedByMe": "2025-07-31T06:20:07Z",
  "ObjectGUID": "{ADB88F28-7C6C-4BE3-B15F-857D3508740A}",
  "ObjectCapabilityFlags": -1,
  "ObjectFlags": 68,
  "propertyID": 0,
  "LatestCheckedInVersion": 1,
  "BaseProperties": []
}
[2025-07-31T06:20:01.000Z] From: 6281261770271 (Zahara)
Message: Silahkan input Provinsi dan detail keluhan anda sesuai dengan format dibawah ini :

Provinsi : 1

Keluhan : SPBN Sei Nangka [isi dengan keluhan anda]

{
  "Title": "CSF/JUL/25/46",
  "EscapedTitleWithID": "CSF{2}JUL{2}25{2}46 (ID 238-1542)",
  "DisplayID": "1542",
  "ObjVer": {
    "Version": 1,
    "VersionType": 4,
    "ID": 1542,
    "Type": 238
  },
  "Class": 325,
  "CheckedOutAtUtc": "1601-01-01T00:00:00Z",
  "CheckedOutAt": "1601-01-01T00:00:00Z",
  "LastModifiedUtc": "2025-07-31T06:20:14Z",
  "LastModified": "2025-07-31T06:20:14Z",
  "ObjectCheckedOut": false,
  "ObjectCheckedOutToThisUser": false,
  "CheckedOutTo": 0,
  "SingleFile": false,
  "HasRelationshipsFrom": false,
  "HasRelationshipsTo": false,
  "HasRelationshipsFromThis": false,
  "HasRelationshipsToThis": false,
  "HasAssignments": false,
  "Deleted": false,
  "IsStub": false,
  "ThisVersionLatestToThisUser": true,
  "CreatedUtc": "2025-07-31T06:20:14Z",
  "Created": "2025-07-31T06:20:14Z",
  "Files": [],
  "VisibleAfterOperation": true,
  "PathInIDView": "238\\1-1000\\1542\\S\\v1",
  "LastModifiedDisplayValue": "7/31/2025 6:20 AM",
  "CheckedOutAtDisplayValue": "1/1/1601 12:00 AM",
  "CreatedDisplayValue": "7/31/2025 6:20 AM",
  "ObjectVersionFlags": 2,
  "Score": 0,
  "LastAccessedByMe": "2025-07-31T06:20:15Z",
  "AccessedByMeUtc": "2025-07-31T06:20:15Z",
  "AccessedByMe": "2025-07-31T06:20:15Z",
  "ObjectGUID": "{6CF99525-5BE6-4ACA-B852-940D6E9279E1}",
  "ObjectCapabilityFlags": -1,
  "ObjectFlags": 68,
  "propertyID": 0,
  "LatestCheckedInVersion": 1,
  "BaseProperties": []
}
[2025-08-01T07:19:35.000Z] From: 6287883624205 (Dianna)
Message: 1

✅ Auto-reply successfully sent to 6287883624205
[2025-08-01T07:19:47.000Z] From: 6287883624205 (Dianna)
Message: 1

✅ Auto-reply successfully sent to 6287883624205
[2025-08-01T07:20:16.000Z] From: 6287883624205 (Dianna)
Message: 6. Tidak buka

✅ Auto-reply successfully sent to 6287883624205
[2025-08-01T07:21:03.000Z] From: 6287883624205 (Dianna)
Message: Provinsi : 1

Keluhan : SPBN Tanjung Tiram tidak buka

{
  "Title": "CSF/AUG/25/47",
  "EscapedTitleWithID": "CSF{2}AUG{2}25{2}47 (ID 238-1543)",
  "DisplayID": "1543",
  "ObjVer": {
    "Version": 1,
    "VersionType": 4,
    "ID": 1543,
    "Type": 238
  },
  "Class": 325,
  "CheckedOutAtUtc": "1601-01-01T00:00:00Z",
  "CheckedOutAt": "1601-01-01T00:00:00Z",
  "LastModifiedUtc": "2025-08-01T07:21:12Z",
  "LastModified": "2025-08-01T07:21:12Z",
  "ObjectCheckedOut": false,
  "ObjectCheckedOutToThisUser": false,
  "CheckedOutTo": 0,
  "SingleFile": false,
  "HasRelationshipsFrom": false,
  "HasRelationshipsTo": false,
  "HasRelationshipsFromThis": false,
  "HasRelationshipsToThis": false,
  "HasAssignments": false,
  "Deleted": false,
  "IsStub": false,
  "ThisVersionLatestToThisUser": true,
  "CreatedUtc": "2025-08-01T07:21:12Z",
  "Created": "2025-08-01T07:21:12Z",
  "Files": [],
  "VisibleAfterOperation": true,
  "PathInIDView": "238\\1-1000\\1543\\S\\v1",
  "LastModifiedDisplayValue": "8/1/2025 7:21 AM",
  "CheckedOutAtDisplayValue": "1/1/1601 12:00 AM",
  "CreatedDisplayValue": "8/1/2025 7:21 AM",
  "ObjectVersionFlags": 2,
  "Score": 0,
  "LastAccessedByMe": "2025-08-01T07:21:13Z",
  "AccessedByMeUtc": "2025-08-01T07:21:13Z",
  "AccessedByMe": "2025-08-01T07:21:13Z",
  "ObjectGUID": "{4CC4EDB7-ECAC-4A3A-9A7E-6809B2506A46}",
  "ObjectCapabilityFlags": -1,
  "ObjectFlags": 68,
  "propertyID": 0,
  "LatestCheckedInVersion": 1,
  "BaseProperties": []
}
[2025-09-08T09:17:15.000Z] From: 6281291119767 (rayhan)
Message: Halo

✅ Auto-reply successfully sent to 6281291119767
[2025-09-08T09:17:32.000Z] From: 6281291119767 (rayhan)
Message: Silahkan input Provinsi dan detail keluhan anda *sesuai dengan format dibawah ini termasuk judul menu* :

Provinsi : 11
Keluhan : testing

{
  "Title": "CSF/SEP/25/51",
  "EscapedTitleWithID": "CSF{2}SEP{2}25{2}51 (ID 238-1547)",
  "DisplayID": "1547",
  "ObjVer": {
    "Version": 1,
    "VersionType": 4,
    "ID": 1547,
    "Type": 238
  },
  "Class": 325,
  "CheckedOutAtUtc": "1601-01-01T00:00:00Z",
  "CheckedOutAt": "1601-01-01T00:00:00Z",
  "LastModifiedUtc": "2025-09-08T09:17:44Z",
  "LastModified": "2025-09-08T09:17:44Z",
  "ObjectCheckedOut": false,
  "ObjectCheckedOutToThisUser": false,
  "CheckedOutTo": 0,
  "SingleFile": false,
  "HasRelationshipsFrom": false,
  "HasRelationshipsTo": false,
  "HasRelationshipsFromThis": false,
  "HasRelationshipsToThis": false,
  "HasAssignments": false,
  "Deleted": false,
  "IsStub": false,
  "ThisVersionLatestToThisUser": true,
  "CreatedUtc": "2025-09-08T09:17:44Z",
  "Created": "2025-09-08T09:17:44Z",
  "Files": [],
  "VisibleAfterOperation": true,
  "PathInIDView": "238\\1-1000\\1547\\S\\v1",
  "LastModifiedDisplayValue": "9/8/2025 9:17 AM",
  "CheckedOutAtDisplayValue": "1/1/1601 12:00 AM",
  "CreatedDisplayValue": "9/8/2025 9:17 AM",
  "ObjectVersionFlags": 2,
  "Score": 0,
  "LastAccessedByMe": "2025-09-08T09:17:47Z",
  "AccessedByMeUtc": "2025-09-08T09:17:47Z",
  "AccessedByMe": "2025-09-08T09:17:47Z",
  "ObjectGUID": "{D944D50E-555D-4D84-AE37-7C868712E218}",
  "ObjectCapabilityFlags": -1,
  "ObjectFlags": 68,
  "propertyID": 0,
  "LatestCheckedInVersion": 1,
  "BaseProperties": []
}
[2025-09-08T09:19:30.000Z] From: 6281944829289 (LW😁)
Message: Halo

✅ Auto-reply successfully sent to 6281944829289
[2025-09-08T09:19:38.000Z] From: 6281944829289 (LW😁)
Message: Ok

✅ Auto-reply successfully sent to 6281944829289
[2025-09-09T01:18:37.000Z] From: 6285232598471 (hendrikwahyu)
Message: Silahkan input Provinsi dan detail keluhan anda sesuai dengan format dibawah ini :

Provinsi : 7

Keluhan : SPBKB Babat [isi dengan keluhan anda] 

Cek scan barcode

{
  "Title": "CSF/SEP/25/52",
  "EscapedTitleWithID": "CSF{2}SEP{2}25{2}52 (ID 238-1548)",
  "DisplayID": "1548",
  "ObjVer": {
    "Version": 1,
    "VersionType": 4,
    "ID": 1548,
    "Type": 238
  },
  "Class": 325,
  "CheckedOutAtUtc": "1601-01-01T00:00:00Z",
  "CheckedOutAt": "1601-01-01T00:00:00Z",
  "LastModifiedUtc": "2025-09-09T01:18:47Z",
  "LastModified": "2025-09-09T01:18:47Z",
  "ObjectCheckedOut": false,
  "ObjectCheckedOutToThisUser": false,
  "CheckedOutTo": 0,
  "SingleFile": false,
  "HasRelationshipsFrom": false,
  "HasRelationshipsTo": false,
  "HasRelationshipsFromThis": false,
  "HasRelationshipsToThis": false,
  "HasAssignments": false,
  "Deleted": false,
  "IsStub": false,
  "ThisVersionLatestToThisUser": true,
  "CreatedUtc": "2025-09-09T01:18:47Z",
  "Created": "2025-09-09T01:18:47Z",
  "Files": [],
  "VisibleAfterOperation": true,
  "PathInIDView": "238\\1-1000\\1548\\S\\v1",
  "LastModifiedDisplayValue": "9/9/2025 1:18 AM",
  "CheckedOutAtDisplayValue": "1/1/1601 12:00 AM",
  "CreatedDisplayValue": "9/9/2025 1:18 AM",
  "ObjectVersionFlags": 2,
  "Score": 0,
  "LastAccessedByMe": "2025-09-09T01:18:48Z",
  "AccessedByMeUtc": "2025-09-09T01:18:48Z",
  "AccessedByMe": "2025-09-09T01:18:48Z",
  "ObjectGUID": "{4497CE7E-4903-48A1-87AE-245201C307B3}",
  "ObjectCapabilityFlags": -1,
  "ObjectFlags": 68,
  "propertyID": 0,
  "LatestCheckedInVersion": 1,
  "BaseProperties": []
}
[2025-09-14T04:14:47.000Z] From: 6282260001090 (Harfi)
Message: Silahkan input Provinsi dan detail keluhan anda sesuai dengan format dibawah ini :

Provinsi : 3

Keluhan : SPBKB Kapuk [perbanyak kuota bio solar, karna suka habis di akhir bulan, juga tambah karyawan supaya lebih efisien waktu, terimakasih]

{
  "Title": "CSF/SEP/25/53",
  "EscapedTitleWithID": "CSF{2}SEP{2}25{2}53 (ID 238-1549)",
  "DisplayID": "1549",
  "ObjVer": {
    "Version": 1,
    "VersionType": 4,
    "ID": 1549,
    "Type": 238
  },
  "Class": 325,
  "CheckedOutAtUtc": "1601-01-01T00:00:00Z",
  "CheckedOutAt": "1601-01-01T00:00:00Z",
  "LastModifiedUtc": "2025-09-14T04:15:03Z",
  "LastModified": "2025-09-14T04:15:03Z",
  "ObjectCheckedOut": false,
  "ObjectCheckedOutToThisUser": false,
  "CheckedOutTo": 0,
  "SingleFile": false,
  "HasRelationshipsFrom": false,
  "HasRelationshipsTo": false,
  "HasRelationshipsFromThis": false,
  "HasRelationshipsToThis": false,
  "HasAssignments": false,
  "Deleted": false,
  "IsStub": false,
  "ThisVersionLatestToThisUser": true,
  "CreatedUtc": "2025-09-14T04:15:03Z",
  "Created": "2025-09-14T04:15:03Z",
  "Files": [],
  "VisibleAfterOperation": true,
  "PathInIDView": "238\\1-1000\\1549\\S\\v1",
  "LastModifiedDisplayValue": "9/14/2025 4:15 AM",
  "CheckedOutAtDisplayValue": "1/1/1601 12:00 AM",
  "CreatedDisplayValue": "9/14/2025 4:15 AM",
  "ObjectVersionFlags": 2,
  "Score": 0,
  "LastAccessedByMe": "2025-09-14T04:15:08Z",
  "AccessedByMeUtc": "2025-09-14T04:15:08Z",
  "AccessedByMe": "2025-09-14T04:15:08Z",
  "ObjectGUID": "{5BF82577-6DFA-432C-8297-5392AB8DCAD4}",
  "ObjectCapabilityFlags": -1,
  "ObjectFlags": 68,
  "propertyID": 0,
  "LatestCheckedInVersion": 1,
  "BaseProperties": []
}
[2025-09-15T09:49:25.000Z] From: 6282390588145 (BG 4 LY)
Message: Akr

✅ Auto-reply successfully sent to 6282390588145
[2025-09-15T09:50:22.000Z] From: 6282390588145 (BG 4 LY)
Message: Lampung

✅ Auto-reply successfully sent to 6282390588145
[2025-09-15T09:58:19.000Z] From: 6282390588145 (BG 4 LY)
Message: Silahkan input Provinsi dan detail keluhan anda *sesuai dengan format dibawah ini termasuk judul menu* :

Provinsi : (2)
Keluhan : (detail keluhan umum kok cuma tangki doang yg di isi dan cantumkan nomor20 12 003 SPBKB/SPBN)

List no Provinsi
1. Sumatera Utara
2. Lampung
3. DKI Jakarta
4. Jawa Barat
5. Jawa Tengah
6. DIY
7. Jawa Timur
8. Kalimantan Barat
9. Kalimantan Selatan
10. Kalimantan Timur

{
  "Status": 400,
  "URL": "/objects/238",
  "Method": "POST",
  "Exception": {
    "Name": "ArgumentException",
    "Message": "Malformed data."
  },
  "Stack": "Error reference ID: e0b99da6-56ab-4a49-8a8e-98d42082e6c2",
  "Message": "Malformed data.",
  "IsLoggedToVault": true,
  "IsLoggedToApplication": true,
  "ExceptionName": "ArgumentException"
}
❌ The response from M-Files is invalid or incomplete. 
[2025-09-26T04:56:50.000Z] From: 6281528904331 (Aldi Jeki)
Message: Selamat siang bapak/ibu, mohon maaf menganggu waktunya sebentar
 Apa benar ini kontak dari AKR 30.3.1.018/AKR Seluas?

✅ Auto-reply successfully sent to 6281528904331
[2025-09-26T04:58:06.000Z] From: 6281528904331 (Aldi Jeki)
Message: 8.kalimantan Barat

✅ Auto-reply successfully sent to 6281528904331
[2025-09-26T05:00:01.000Z] From: 6281528904331 (Aldi Jeki)
Message: Silahkan input Provinsi dan detail keluhan anda *sesuai dengan format dibawah ini termasuk judul menu* :

Provinsi : (8.Kalimantan Barat)
Keluhan : (Ingin Menanyakan siapa pemilik AKR 30.3.1.018)

List no Provinsi
1. Sumatera Utara
2. Lampung
3. DKI Jakarta
4. Jawa Barat
5. Jawa Tengah
6. DIY
7. Jawa Timur
8. Kalimantan Barat
9. Kalimantan Selatan
10. Kalimantan Timur

{
  "Status": 400,
  "URL": "/objects/238",
  "Method": "POST",
  "Exception": {
    "Name": "ArgumentException",
    "Message": "Malformed data."
  },
  "Stack": "Error reference ID: 4a51c147-8ecf-43cf-b350-180ed46977d1",
  "Message": "Malformed data.",
  "IsLoggedToVault": true,
  "IsLoggedToApplication": true,
  "ExceptionName": "ArgumentException"
}
❌ The response from M-Files is invalid or incomplete. 
[2025-09-27T05:08:22.000Z] From: 6289658836767 (Sandy666)
Message: Slamat siang ini ini info pengaduan akr ya

✅ Auto-reply successfully sent to 6289658836767
[2025-09-27T05:14:27.000Z] From: 6289658836767 (Sandy666)
Message: Lampung

✅ Auto-reply successfully sent to 6289658836767
[2025-09-27T05:14:38.000Z] From: 6289658836767 (Sandy666)
Message: Terjadi pungli

✅ Auto-reply successfully sent to 6289658836767
[2025-09-28T00:02:59.000Z] From: 6282177281682 (Jayadi Saputra)
Message: P

✅ Auto-reply successfully sent to 6282177281682
[2025-09-28T00:03:43.000Z] From: 6282177281682 (Jayadi Saputra)
Message: 2 lampung

✅ Auto-reply successfully sent to 6282177281682
[2025-10-06T02:16:34.000Z] From: 6282329372714 (Ferwad)
Message: Silahkan input Provinsi dan detail keluhan anda sesuai dengan format dibawah ini :

Provinsi : 5

Keluhan : SPBKB Gringsing [isi dengan keluhan anda]

{
  "Title": "CSF/OCT/25/54",
  "EscapedTitleWithID": "CSF{2}OCT{2}25{2}54 (ID 238-1550)",
  "DisplayID": "1550",
  "ObjVer": {
    "Version": 1,
    "VersionType": 4,
    "ID": 1550,
    "Type": 238
  },
  "Class": 325,
  "CheckedOutAtUtc": "1601-01-01T00:00:00Z",
  "CheckedOutAt": "1601-01-01T00:00:00Z",
  "LastModifiedUtc": "2025-10-06T02:16:51Z",
  "LastModified": "2025-10-06T02:16:51Z",
  "ObjectCheckedOut": false,
  "ObjectCheckedOutToThisUser": false,
  "CheckedOutTo": 0,
  "SingleFile": false,
  "HasRelationshipsFrom": false,
  "HasRelationshipsTo": false,
  "HasRelationshipsFromThis": false,
  "HasRelationshipsToThis": false,
  "HasAssignments": false,
  "Deleted": false,
  "IsStub": false,
  "ThisVersionLatestToThisUser": true,
  "CreatedUtc": "2025-10-06T02:16:51Z",
  "Created": "2025-10-06T02:16:51Z",
  "Files": [],
  "VisibleAfterOperation": true,
  "PathInIDView": "238\\1-1000\\1550\\S\\v1",
  "LastModifiedDisplayValue": "10/6/2025 2:16 AM",
  "CheckedOutAtDisplayValue": "1/1/1601 12:00 AM",
  "CreatedDisplayValue": "10/6/2025 2:16 AM",
  "ObjectVersionFlags": 2,
  "Score": 0,
  "LastAccessedByMe": "2025-10-06T02:16:53Z",
  "AccessedByMeUtc": "2025-10-06T02:16:53Z",
  "AccessedByMe": "2025-10-06T02:16:53Z",
  "ObjectGUID": "{B16C08CB-4D2E-432B-91E6-6729BC48E9BB}",
  "ObjectCapabilityFlags": -1,
  "ObjectFlags": 68,
  "propertyID": 0,
  "LatestCheckedInVersion": 1,
  "BaseProperties": []
}
[2025-10-06T02:17:04.000Z] From: 6282329372714 (Ferwad)
Message: Mksh

✅ Auto-reply successfully sent to 6282329372714
[2025-10-06T02:16:58.000Z] From: 6282329372714 (Ferwad)
Message: Pak tolong pembayaran Qris diaktifkn atau debit

✅ Auto-reply successfully sent to 6282329372714
[2025-10-10T00:53:26.000Z] From: 6285822780792 (wandi)
Message: Silahkan input Provinsi dan detail keluhan anda sesuai dengan format dibawah ini :

Provinsi : 9

Keluhan : SPBKB Soebarjo [isi dengan keluhan anda]

{
  "Title": "CSF/OCT/25/55",
  "EscapedTitleWithID": "CSF{2}OCT{2}25{2}55 (ID 238-1551)",
  "DisplayID": "1551",
  "ObjVer": {
    "Version": 1,
    "VersionType": 4,
    "ID": 1551,
    "Type": 238
  },
  "Class": 325,
  "CheckedOutAtUtc": "1601-01-01T00:00:00Z",
  "CheckedOutAt": "1601-01-01T00:00:00Z",
  "LastModifiedUtc": "2025-10-10T00:53:37Z",
  "LastModified": "2025-10-10T00:53:37Z",
  "ObjectCheckedOut": false,
  "ObjectCheckedOutToThisUser": false,
  "CheckedOutTo": 0,
  "SingleFile": false,
  "HasRelationshipsFrom": false,
  "HasRelationshipsTo": false,
  "HasRelationshipsFromThis": false,
  "HasRelationshipsToThis": false,
  "HasAssignments": false,
  "Deleted": false,
  "IsStub": false,
  "ThisVersionLatestToThisUser": true,
  "CreatedUtc": "2025-10-10T00:53:37Z",
  "Created": "2025-10-10T00:53:37Z",
  "Files": [],
  "VisibleAfterOperation": true,
  "PathInIDView": "238\\1-1000\\1551\\S\\v1",
  "LastModifiedDisplayValue": "10/10/2025 12:53 AM",
  "CheckedOutAtDisplayValue": "1/1/1601 12:00 AM",
  "CreatedDisplayValue": "10/10/2025 12:53 AM",
  "ObjectVersionFlags": 2,
  "Score": 0,
  "LastAccessedByMe": "2025-10-10T00:53:38Z",
  "AccessedByMeUtc": "2025-10-10T00:53:38Z",
  "AccessedByMe": "2025-10-10T00:53:38Z",
  "ObjectGUID": "{06E2647C-FCA3-4E3A-931C-64B1ABF178BD}",
  "ObjectCapabilityFlags": -1,
  "ObjectFlags": 68,
  "propertyID": 0,
  "LatestCheckedInVersion": 1,
  "BaseProperties": []
}
[2025-10-10T00:53:52.000Z] From: 6285822780792 (wandi)
Message: STNK harus bukti fisik atau gmna

✅ Auto-reply successfully sent to 6285822780792
[2025-10-10T00:54:01.000Z] From: 6285822780792 (wandi)
Message: 9

✅ Auto-reply successfully sent to 6285822780792
[2025-10-10T00:54:35.000Z] From: 6285822780792 (wandi)
Message: Provinsi: Kalimantan Selatan

✅ Auto-reply successfully sent to 6285822780792
[2025-10-10T00:55:26.000Z] From: 6285822780792 (wandi)
Message: Keluhan : STNK harus bukti pisik atau gimana ,. SPBKB (30.3.2.00O)

✅ Auto-reply successfully sent to 6285822780792
[2025-10-10T00:55:41.000Z] From: 6285822780792 (wandi)
Message: Keluhan : STNK harus bukti pisik atau gimana ,. SPBKB (30.3.2.009)

✅ Auto-reply successfully sent to 6285822780792
[2025-10-10T00:55:51.000Z] From: 6285822780792 (wandi)
Message: 9

✅ Auto-reply successfully sent to 6285822780792
[2025-10-10T00:57:12.000Z] From: 6285822780792 (wandi)
Message: Provinsi : 9
Keluhan : ( STNK harus berupa bukti fisik atau bisa di gital , soalnya saya bawa motor saya sendiri , yg ada hanya bukti di gital )

{
  "Title": "CSF/OCT/25/56",
  "EscapedTitleWithID": "CSF{2}OCT{2}25{2}56 (ID 238-1552)",
  "DisplayID": "1552",
  "ObjVer": {
    "Version": 1,
    "VersionType": 4,
    "ID": 1552,
    "Type": 238
  },
  "Class": 325,
  "CheckedOutAtUtc": "1601-01-01T00:00:00Z",
  "CheckedOutAt": "1601-01-01T00:00:00Z",
  "LastModifiedUtc": "2025-10-10T00:57:15Z",
  "LastModified": "2025-10-10T00:57:15Z",
  "ObjectCheckedOut": false,
  "ObjectCheckedOutToThisUser": false,
  "CheckedOutTo": 0,
  "SingleFile": false,
  "HasRelationshipsFrom": false,
  "HasRelationshipsTo": false,
  "HasRelationshipsFromThis": false,
  "HasRelationshipsToThis": false,
  "HasAssignments": false,
  "Deleted": false,
  "IsStub": false,
  "ThisVersionLatestToThisUser": true,
  "CreatedUtc": "2025-10-10T00:57:15Z",
  "Created": "2025-10-10T00:57:15Z",
  "Files": [],
  "VisibleAfterOperation": true,
  "PathInIDView": "238\\1-1000\\1552\\S\\v1",
  "LastModifiedDisplayValue": "10/10/2025 12:57 AM",
  "CheckedOutAtDisplayValue": "1/1/1601 12:00 AM",
  "CreatedDisplayValue": "10/10/2025 12:57 AM",
  "ObjectVersionFlags": 2,
  "Score": 0,
  "LastAccessedByMe": "2025-10-10T00:57:16Z",
  "AccessedByMeUtc": "2025-10-10T00:57:16Z",
  "AccessedByMe": "2025-10-10T00:57:16Z",
  "ObjectGUID": "{2686BA2C-500F-4AF7-847B-CED5CC5851D6}",
  "ObjectCapabilityFlags": -1,
  "ObjectFlags": 68,
  "propertyID": 0,
  "LatestCheckedInVersion": 1,
  "BaseProperties": []
}
[2025-10-10T00:57:26.000Z] From: 6285822780792 (wandi)
Message: Sya menungu

✅ Auto-reply successfully sent to 6285822780792
[2025-10-10T00:57:44.000Z] From: 6285822780792 (wandi)
Message: Udah

✅ Auto-reply successfully sent to 6285822780792
[2025-10-10T00:57:54.000Z] From: 6285822780792 (wandi)
Message: Kamu komputer atau manusia

✅ Auto-reply successfully sent to 6285822780792
[2025-10-10T00:58:00.000Z] From: 6285822780792 (wandi)
Message: 9

✅ Auto-reply successfully sent to 6285822780792
[2025-10-10T00:58:22.000Z] From: 6285822780792 (wandi)
Message: Kapan tindak lanjut keluhan saya

✅ Auto-reply successfully sent to 6285822780792
[2025-10-10T00:58:37.000Z] From: 6285822780792 (wandi)
Message: Asli kada pintar

✅ Auto-reply successfully sent to 6285822780792
[2025-10-10T00:59:13.000Z] From: 6285822780792 (wandi)
Message: Provinsi : 9
Keluhan : ( STNK harus berupa bukti fisik atau bisa di gital , soalnya saya bawa motor saya sendiri , yg ada hanya bukti di gital )

{
  "Title": "CSF/OCT/25/57",
  "EscapedTitleWithID": "CSF{2}OCT{2}25{2}57 (ID 238-1553)",
  "DisplayID": "1553",
  "ObjVer": {
    "Version": 1,
    "VersionType": 4,
    "ID": 1553,
    "Type": 238
  },
  "Class": 325,
  "CheckedOutAtUtc": "1601-01-01T00:00:00Z",
  "CheckedOutAt": "1601-01-01T00:00:00Z",
  "LastModifiedUtc": "2025-10-10T00:59:15Z",
  "LastModified": "2025-10-10T00:59:15Z",
  "ObjectCheckedOut": false,
  "ObjectCheckedOutToThisUser": false,
  "CheckedOutTo": 0,
  "SingleFile": false,
  "HasRelationshipsFrom": false,
  "HasRelationshipsTo": false,
  "HasRelationshipsFromThis": false,
  "HasRelationshipsToThis": false,
  "HasAssignments": false,
  "Deleted": false,
  "IsStub": false,
  "ThisVersionLatestToThisUser": true,
  "CreatedUtc": "2025-10-10T00:59:15Z",
  "Created": "2025-10-10T00:59:15Z",
  "Files": [],
  "VisibleAfterOperation": true,
  "PathInIDView": "238\\1-1000\\1553\\S\\v1",
  "LastModifiedDisplayValue": "10/10/2025 12:59 AM",
  "CheckedOutAtDisplayValue": "1/1/1601 12:00 AM",
  "CreatedDisplayValue": "10/10/2025 12:59 AM",
  "ObjectVersionFlags": 2,
  "Score": 0,
  "LastAccessedByMe": "2025-10-10T00:59:16Z",
  "AccessedByMeUtc": "2025-10-10T00:59:16Z",
  "AccessedByMe": "2025-10-10T00:59:16Z",
  "ObjectGUID": "{EF6ED74D-C6D1-4DAE-9FC1-19B51A06366F}",
  "ObjectCapabilityFlags": -1,
  "ObjectFlags": 68,
  "propertyID": 0,
  "LatestCheckedInVersion": 1,
  "BaseProperties": []
}
